opt1	opt2	type	corr_opt	sent	full_id
zuccheri	zucchero	foil	0	Un individuo recentemente riferito nel divorzio della platea , prestato che il	f_contr_3
movimento	movimenti	foil	0	Al cinquecentomila del quindicesimo volo realismo insostenibile con Borbone su	f_contr_8
grasse	grassa	foil	0	C' chiude gioia che ricomprende siamo documenti raffinati e esclusivamente la prostituzione è lì	f_contr_10
navi	nave	foil	0	opinion Torre - L' imperatore d' Opera ( o necessariamente l' impulso con	f_contr_16
vissute	vissuta	foil	0	""" Quando una ricostruzione riprende un preventivo distretto deve essere iraniana , ulteriormente certe colonie mi sono"	f_contr_19
creata	create	foil	0	Qui Caritas mica ha rimasto le latte sulla sua risoluta denominazione alta durante i David del mille ,	f_contr_20
peggiore	peggiori	foil	0	""" Voglio clandestinamente dipingere ugualmente cosa ha rivelato Dallas , praticamente io ringrazio volontariamente di far nel corazziere"	f_contr_23
senatore	senatori	foil	0	Per questo beve la propria idea improvvisamente sulla vecchiaia di certe novità che hanno reagito un' abbreviazione a	f_contr_25
pascolo	pascoli	foil	0	Capitale potrà piangere assolutamente Leonard , che trovando Scout in	f_contr_29
limoni	limone	foil	0	Le prime scienze furono Sant Luca e Jean Alessandro Schäuble , previste dal menu all' orologio di	f_contr_30
italiano	italiani	foil	0	Marlowe Malta Ansaldo , mille uomini , alloggio sacro , altra disambiguazione previa nel dibattito economico , è eccessivamente sostituito il sessanta	f_contr_31
responsabili	responsabile	foil	0	Amsterdam Londra gestisce la malapena in Pino della Telecom e Bergamo	f_contr_35
conduce	conducono	foil	0	""" Conformemente guardie - adegua il conducente - durante le montagne Gene Crimea ci siamo fissati titolo che lo Nike"	f_contr_39
diverso	diversi	foil	0	Stephen Niccolò Calcutta è caduto donato in pochi indigeni da un migliaio	f_contr_44
cantava	cantavano	foil	0	I narcotrafficanti del professor di Koch Salerno , dedicati dai decreti , l' hanno garantito esiguo mentre	f_contr_45
teorici	teorico	foil	0	Il lirico patriarca Radiofreccia Rosaria , scrutinio di dovere alla parola competente di Volandri , neanche ha sospeso	f_contr_48
ultimi	ultimo	foil	0	Indice un abuso , l' esplosivo , si procede Facebook UNESCO , comincia cinquemila	f_contr_51
sufficienti	sufficiente	foil	0	I connazionali di Trinidad sarebbero corteccia che raggiunge da un nuoto del	f_contr_60
restano	resta	foil	0	Sì , è letterario , a Marcos c' giunge molta sopravvivenza , ma neanche straordinariamente di quella che si	f_contr_63
posti	posto	foil	0	O quella che sposta per bassista il ghiaccio di una delle goccioline che ha	f_contr_64
disposto	disposti	foil	0	L' ingegnere elettromagnetico è attaccato dai tossicodipendenti di un diciannovesimo battesimo ,	f_contr_66
gambe	gamba	foil	0	"Tra le baracche strettamente calcolate dalla "" serra "" del gorilla concreto ci pensano guerra Giove Sole e"	f_contr_70
ideologia	ideologie	foil	0	DVD Times , patrimonio , ventiquattro avvisi , antisommossa arredo a Marley , e fontana Monaco ,	f_contr_76
ordinanze	ordinanza	foil	0	La presidenza Miguel , preventivamente jugoslava e preventivamente quotidiana di	f_contr_78
destinatari	destinatario	foil	0	Servizi , antenne , pianoforti , insetti nutrizionali , relazioni , camini , economisti e	f_contr_79
citato	citati	foil	0	Per effettivamente i dimostranti resi in novità , oppure dunque	f_contr_81
giunge	giungono	foil	0	Per la decorazione di inizialmente , insomma , le pillole padrone	f_contr_82
freno	freni	foil	0	Successivamente ammesso il muscolo fra i tremila ospiti e Lesmo in carabiniere alle suddette poste durante i primi scrittori di	f_contr_85
femminili	femminile	foil	0	Duecentomila manifestanti hanno battezzato a sperimentazioni , per fuga in bozza nemmeno	f_contr_87
interessati	interessato	foil	0	""" Si sono trovati a pochi rapinatori da finalmente mi sentivo io - ha disciolto il nucleo - e facevano"	f_contr_89
singoli	singolo	foil	0	Come ogni analizzatore la guerriglia cercherà restare una Cina ma il gregge del domenicale viene designato periodicamente	f_contr_90
tinta	tinte	foil	0	Una crosta è penale in sfogo fra le ventun e le ventiquattro immagini , di	f_contr_99
sa	sanno	foil	0	""" Sì , chiaramente se qualcuno rileva il perfetto e neppure"	f_contr_100
colloqui	colloquio	foil	0	il bisogno di mare da interferenze sul quale il consulente , abrogato di aria , doveva assassinare a dipingere a	f_contr_101
norma	norme	foil	0	Era un modo per scoraggiare l' onor del mento , in mancanza d' impossibili canoni estetico piliferi precisi tali da rispondere a	f_contr_103
difetto	difetti	foil	0	A farsi dal cinque , costoro permisero su cinquanta filtri di Resource dei campi gassosi che investivano come vicepresidente il	f_contr_107
iniziati	iniziato	foil	0	Si viveva di un Tesoro hard , risposto dalla Foto Pubblica ,	f_contr_108
decise	decisa	foil	0	La scuola chiama a positivo fregio e dispone la programmazione della sessualità dalle spie di un partner , oppure da	f_contr_109
collegamento	collegamenti	foil	0	Un imprecisato guanto quantomeno stalinista è la persona , che , offrendo , compone uno	f_contr_112
marca	marche	foil	0	Dietro va restituito che il controllo Valle concretamente registra una mezzanotte fuori	f_contr_114
diplomatici	diplomatico	foil	0	una nave parimenti ampia , in cui propone disco quella riabilitazione di	f_contr_115
successi	successo	foil	0	E la felicità nemmeno appare che i protagonisti siano soliti e illegalmente serviti , che la chitarra di cronaca sia domandata a	f_contr_117
senatore	senatori	foil	0	Dipende pubblicamente che è palestinese offrire , su un settore prossimo , uno primitivo stagionale pseudonimo , esaurito all' equipaggio , con	f_contr_118
splendori	splendore	foil	0	Una frequenza di scetticismo , regolato finora di innovazione , ma soltanto al	f_contr_119
tela	tele	foil	0	Il Traviata nemmeno è spudoratamente un accento , e neanche una ragione di raccolta rapita di	f_contr_120
tecnici	tecnico	foil	0	""" Photographic "" ( strano e hard ) e "" Coleridge Hoxha "" ,"	f_contr_125
menzionata	menzionate	foil	0	Di Servizio Strano ( manager Leeds ) poltrone di attiguo piatto ( trenta barrage ) ,	f_contr_126
custodi	custode	foil	0	Nello maestoso miraggio di Vietnam , sapendo di requisiti in	f_contr_127
contrasti	contrasto	foil	0	Tenendo in contadino , proponiamo a un ottimo febbraio , elaborato con	f_contr_133
poeti	poeta	foil	0	Per assumere i condomini , il sesto bottino di naufragio viene lavato ,	f_contr_137
pesche	pesca	foil	0	Ora con queste private ( ma linguistiche ) piante si possono affermare finestre aggressive e ruoli , per accettare	f_contr_138
luogo	luoghi	foil	0	Si rivelano su malore di simbolo e pista e si servono con istanza e	f_contr_139
medicinale	medicinali	foil	0	Ferme , vulnerabili , orientali , coltivabili , a teoria , a cantiere , a	f_contr_143
utilizzata	utilizzate	foil	0	Intanto la Churchill Butt attende alla consuetudine di tribù un' ipotesi implacabile che ripaga a siepe ferie	f_contr_144
basso	bassi	foil	0	All' intento della roccia è stato controllato un fotochimico e	f_contr_147
data	date	foil	0	VINCONO pochi nuclei al declino per agire una depressione differente , l' ingegner è associarsi in	f_contr_148
carenza	carenze	foil	0	una moda attestate le poltrone del villaggio , la tipologia è a fondazione di	f_contr_153
rocce	roccia	foil	0	"a fetta "" Stonit COSPAR Fossey "" di Batman Rosso da proseguire sul striscione ogni pendio dopo sterminio o"	f_contr_156
resina	resine	foil	0	E per le feste : lamentele riconosciute Joe , trecento o quaranta finanze la	f_contr_157
ordinanze	ordinanza	foil	0	Se il carabiniere è costoso , una atmosferica mutazione sproporzionata resterà servirsene con	f_contr_158
unghie	unghia	foil	0	Se il pericolo è applicabile , vedi direttamente virus alle visite tipiche (	f_contr_159
direttive	direttiva	foil	0	MILIONI elencati , neve integrata e turistica sono la spedizione ( eccezionale ) di furbo alloggio veneziano , assicurazione magica ,	f_contr_160
rivolte	rivolta	foil	0	Per il tributo della piscina , cambia nuotare alla banconota anche undici vigilia al discorso e sistemare i bambini se sei	f_contr_161
sondaggio	sondaggi	foil	0	Anzi , ricorda al stagno la fonte parlata con uno	f_contr_163
scoperta	scoperte	foil	0	E in ginocchio di avulsione ai primi prezzi del crimine annota un buste legittimo di	f_contr_164
taglio	tagli	foil	0	dieci ) Scopri un deputato di duemila cuscini storicamente in	f_contr_167
sponde	sponda	foil	0	Ci manifestano organizzatori almeno , che perlopiù rivelano ogni torrente di essere in	f_contr_168
distintivi	distintivo	foil	0	... Elenca con sorgente ogni ragazza intensa e paternità e annota i capelli , intenzionalmente	f_contr_169
statuti	statuto	foil	0	africani bisogni e reti per confermare in diaspora Servizio maschera chiusura di rielezione giornalismo per	f_contr_170
collaboratore	collaboratori	foil	0	Questa suggerisce aspettare la geniale chiusura in Times dell' accademia che lo cacao Johannes Kharroubi ha frantumato alla Grammy ,	f_contr_172
modesti	modesto	foil	0	Swoboda Copland è uno nemico d' editoria povera , nipote della presentazione Oscar , scade in	f_contr_175
freschi	fresco	foil	0	Nello collettivo logo se ne agiscono tutti gli assurdi massacri , dimostrando di	f_contr_178
capitali	capitale	foil	0	nemmeno soltanto quelli spaziali al finestrino Churchill e alla Modigliani	f_contr_179
mano	mani	foil	0	Il memoriale e molti dei sistemi sono stati varie ragazze assegnati e a votivo in	f_contr_187
depositi	deposito	foil	0	Se ci diventassero successivamente sponde da contadino nelle metafore d' Austria , ci vorrebbero recentemente	f_contr_194
arbitro	arbitri	foil	0	Nemmeno c' invocava nessuna scuola permanente o infinita nella nonna dell' annullamento su tigre assente di linea	f_contr_195
dottor	dottori	foil	0	"E la rigorosa "" corrispondenza "" era costruita correttamente da professionali fisiocrati ,"	f_contr_196
titoli	titolo	foil	0	in Alain sono anzi mila trecento le immagini piovane imprenditoriali e di radiazione e finora di tredici trecento le sostenibilità neanche di	f_contr_199
pregiate	pregiata	foil	0	Appare esplicitamente la fiction dell' apparecchio del tifo e una cittadina inevitabilmente musicale prestanome alla modalità	f_contr_203
registra	registrano	foil	0	Le rappresentanze in Andrew che posano una roccia di ramo	f_contr_206
migliori	migliore	foil	0	Infatti , è solare negoziare che chiunque spetti a Copland Tobago può cucinare con una reputazione di naturalmente	f_contr_209
trasferimento	trasferimenti	foil	0	sei giorni ( quattro notti nella Big Apple ) con viaggio aereo in classe Ambassador ,	f_contr_210
cercava	cercavano	foil	0	Il suo biografo nemmeno aveva saputo allo sequestratario di ripetere a fiato i ventiquattro cecchini e cinquanta timori che	f_contr_212
ricordo	ricordiamo	foil	0	Ricordo in tipologia , sono progettato a sopprimere , vedo di tutto ,	f_contr_213
astronauti	astronauta	foil	0	Erano messi scientifici miglioramenti barrage e i cinquecentomila sono stati tagliati da un meridiano con orecchie di bel	f_contr_218
secondi	secondo	foil	0	concretamente ferocemente , un visitatore rimane con gesti illegali una soda di	f_contr_223
accordi	accordo	foil	0	Mazara , il trattamento , applica in barbarie un pontefice d'	f_contr_226
treno	treni	foil	0	A progredire la strage sono colture di ogni suggerimento , consumatori e jeep che si viaggiano detentore a	f_contr_228
modifica	modifiche	foil	0	Il profugo è un' incredibile fusione nei lastrici di Tōhoku , duramente donato a	f_contr_237
adatto	adatti	foil	0	Fu certamente contestato che il shampoo di Fujimori , il scrittore degli sviluppi , l' esclusivo amministrativo protagonista	f_contr_240
abusi	abuso	foil	0	quest' ottava ha , apparentemente , continuato che la farfalla di suolo ricavata a polistirolo di	f_contr_248
zuccheri	zucchero	foil	0	La normalità ferita è democratica a superfici grandi per il	f_contr_257
preferenza	preferenze	foil	0	Il tricolore ai servizi è stato convocato dal coro altrove in	f_contr_264
viaggio	viaggi	foil	0	Il padiglione ammesso dall' anticonformismo familiare può salvaguardare il cannone di	f_contr_265
elica	eliche	foil	0	I presepi d' aghi posseduti in realtà di motivi d'	f_contr_270
cliniche	clinica	foil	0	trecento . Obblighi neanche negativi all' allievo delle chances o a segretaria	f_contr_275
difetti	difetto	foil	0	Qualora il filone voglia esercitare la consulenza della contea presentata del scetticismo , si pare	f_contr_283
concentra	concentrano	foil	0	Chi presso il litorale , esattamente se su questo si	f_contr_286
rivolta	rivolte	foil	0	Una scala inferiore , almeno , potrebbe concedere il supporto di	f_contr_287
ottiene	ottengono	foil	0	Le manifestazioni istruite mica si devono intenderci se sul licenziante	f_contr_290
lavoratori	lavoratore	foil	0	ventisei . Anni presso sentenze , tappeti e sul nodo di	f_contr_292
persone	persona	foil	0	Il vertice può intervenire che si alterino gli ossidi e le distinzioni che sono percepiti o conducono a	f_contr_293
ampia	ampie	foil	0	Se si vuole unirsi la ferita villeggiatura al processo in cui combattono le metropolitane vendite fisiche od	f_contr_304
dicono	dice	foil	0	La vigilia finge una serena prosa con l' impedimento duemila , ma	f_contr_305
palazzo	palazzi	foil	0	L' invecchiamento può diversamente essere giocato dalle cerimonie che possono consistere una libertà [ ricorda ventiquattro ] di discorso (	f_contr_306
applica	applicano	foil	0	L' investimento , che diffonde al settembre nucleare trasmesso dall' imprenditore trecento ,	f_contr_311
diviene	divengono	foil	0	Le ambulanze devono essere arrivate in conseguimento che il riordinamento del conflitto , in cui esse si	f_contr_312
vai	andate	foil	0	Gli ubriaconi cinquemila e ventisei accumulano un africano peso sperimentale alla sintesi [	f_contr_313
numeri	numero	foil	0	Nel clamore incitato dall' avanzamento quindici , il vetro può altronde essere vincolato d' importatore dall' inammissibilità invertita , allo	f_contr_316
discriminazione	discriminazioni	foil	0	In quest' attacco viene convinta l' ordinanza di un regionalismo ( inventario , partenza o altra corruzione ) al patrimonio aziendale per	f_contr_320
russe	russa	foil	0	Il mito nemmeno può indurlo il primo a nuotare le prestazioni ,	f_contr_325
ebrei	ebreo	foil	0	Il 2° dollaro dell' indulto prepara l' ideologia [ ricorda sette ] di un pianoforte cautelare ad	f_contr_334
muscoli	muscolo	foil	0	Il casco che l' amministrazione sottintende quando essa sorprende all' antologia dello	f_contr_340
guadagni	guadagno	foil	0	Le serate degli organismi duecento , diciotto e duecentomila si intrattengono ai risparmiatori fortunatamente espulsi sia a	f_contr_345
principe	principi	foil	0	A birra del proprio rinforzo , il condomino può educare le esigenze di	f_contr_348
affondano	affonda	foil	0	L' esposizione del ritrovamento di droga per vendita del circuito [ duecento ]	f_contr_350
radicale	radicali	foil	0	L' ingegner del dirupo del rigore ( zero , trecento ) mantiene velocemente ( duecento e	f_contr_355
soliti	solito	foil	0	Se più sono gli apparati , l' impugnazione può fornire innanzitutto da uno	f_contr_360
minima	minime	foil	0	In questo montaggio l' esistente costringe ( cinquecentomila ) nei difetti del servente verso gli esclusivi esami ,	f_contr_361
fabbricanti	fabbricante	foil	0	tredici ) se l' artista è in decisione nel nocumento di tremila identità di	f_contr_363
principio	principi	foil	0	Quando sfocia l' esclusività all' artista disegna il sintomo dei fili nella petroliera dell' inizio di	f_contr_368
verso	versi	foil	0	Se le indagini neppure sono fluorescenti senza suono e giocano	f_contr_369
partiti	partito	foil	0	Le gambe per la dittatura e il cartone sono a	f_contr_372
riportano	riporta	foil	0	Se il delegatario dà di accumularsi le forze contraffatte a suo compagno o ne	f_contr_382
elicottero	elicotteri	foil	0	A pelle del luogo l' impatto realizza difetto di farvi l' allenatore pietrificato ( quattro ;	f_contr_383
segni	segno	foil	0	Le carte dei ventun addetti consumabili si importano altamente nel socialismo in cui , per celebrità o	f_contr_384
nomine	nomina	foil	0	Nelle imprevedibilità cresciute dal diciannovesimo costruttore dell' ausilio zero e dal settimo numero dell' iodio ventisei , l' arresto copre carcere di	f_contr_387
condizioni	condizione	foil	0	Il sito del cono riducente neanche è rafforzato a commettere alcun argomento per sottoporre residenziale l' ingegner della maternità da	f_contr_393
superato	superati	foil	0	Può espressamente essere concessa con ufficio dell' esternalità agricola nei volumi sicuramente	f_contr_394
apparecchiature	apparecchiatura	foil	0	Quasi di incrementare la striscia dell' appuntamento , chi vuol ripetere	f_contr_398
milione	milioni	foil	0	Se si dispone conseguimento al fenomeno , può essere accusata una cospicua opportunità a coloro che al	f_contr_405
conto	conti	foil	0	Se il massaggio è ripreso da ogni nebbia rispettivo per alloggio di origine a	f_contr_409
area	aree	foil	0	Se il condomino suggerisce di essere turistico , può essere puntato in qualunque venditore a	f_contr_410
femmine	femmina	foil	0	La diligenza del pizzico di follia gioca fantasma quando spetta , mediante qualunque vescovo di	f_contr_414
impedisce	impediscono	foil	0	Tuttavia , se l' originario esercizio è divenuto più gravoso per il fondo servente o se	f_contr_416
formale	formali	foil	0	La zingara o l' attrice della cocaina ( quindici e	f_contr_420
spazio	spazi	foil	0	Può apparentemente prevenire la cancellazione delle vetrate in lenzuolo , oltre il	f_contr_422
compiuta	compiute	foil	0	Nei contenuti seri a coppie per presidenza le idee derivanti o ridotte , ma	f_contr_425
fabbricante	fabbricanti	foil	0	Con ferocia della persona dei valonesi che disponga esattamente mila	f_contr_431
praticano	pratica	foil	0	Il macchinista che ha creduto il novembre in lungomare e neppure ha esercitato gusto	f_contr_433
vuoi	volete	foil	0	Se per l' operatore è staccato un rito , questo si vieta a condominio del marchio , qualora neanche	f_contr_441
conta	contano	foil	0	Quando in comunismo dell' ebano è minacciato un condominio , l' ipotesi si ammette con la convocazione del disagio , se neppure	f_contr_448
gode	godono	foil	0	Se il cannone siede di aspettare l' alimentazione liberale o neppure si	f_contr_456
posta	poste	foil	0	Il cotone che ha diventato , verso segnale , alla prestazione	f_contr_468
ambientazione	ambientazione	foil	0	Il restante può cacciare la carta , fuoripista a quando il zolfo neanche abbia intervenuto l'	f_contr_477
esplosione	esplosioni	foil	0	Il ritardo ampio e il difetto di voce o di canale d' una attrice od	f_contr_488
strategico	strategici	foil	0	La presenza può dedicarsi , con deliberazioni di ricevitore presente , che siano sballottati	f_contr_489
pacchetti	pacchetto	foil	0	Nessuno può essere tolto se neanche in carenza di una locazione che sia inventata in	f_contr_491
recenti	recente	foil	0	I liquami e i dirigenti dello Regolamento e degli errori fonografici sono preventivamente fiscali , secondo le decisioni mediorientali ,	f_contr_494
lanciano	lancia	foil	0	La Lotteria necessita la corruzione come laziale scetticismo dell' odore e esempio della formalità , e	f_contr_495
dibattito	dibattiti	foil	0	I rurali e navigabili , attentamente se religiosi di tassi , rimangono reclamo di sparare i massacri regolarmente identici degli	f_contr_498
fiumi	fiume	foil	0	La squadra teme i torrenti e i verbali increduli perché l' utilità ellittica gialla e positiva possa essere istituita e conservata a	f_contr_501
numero	numeri	foil	0	I sfollati universitari addentrano allo Convegno , ad acquedotti o a	f_contr_502
piene	piena	foil	0	nobilmente ciascuna delle duemila Provincie e il Diritto a Finanze rese possono tutelare di applicare in particella	f_contr_511
ire	ira	foil	0	Ottima aula è vissuta per seguire i turisti del Tesoro ad	f_contr_514
stoffa	stoffe	foil	0	Può esclusivamente favorire in quali dispositivi e pubblicazioni l' aquilone e l' orbita dei farmaci di	f_contr_517
direttore	direttori	foil	0	Le zanzare sono sostenute dal Dipartimento della Consulta entro un	f_contr_520
violazioni	violazione	foil	0	In ogni segno l' espropriazione e l' asfalto neppure possono invitarla ai creatori completati praticamente alla vedova del dono di	f_contr_524
migliori	migliore	foil	0	L' ispiratore destro del settore neanche può essere dichiarato se neppure per doccia e per cereali neppure	f_contr_525
lungo	lunghi	foil	0	Può essere assegnato Poligono della Signora ogni rigetto che abbia fornito mille incarichi d' ingenuità e rechi dei presidenti volatili e	f_contr_527
leggi	legge	foil	0	Sembra il perimetro delle Ferrovie universitarie , sogna il Diritto gelato di	f_contr_528
testimonianze	testimonianza	foil	0	In tali ragazzi è concesso in mostro di accessione dal Trasporto in funzione tendenziale , a	f_contr_530
firmato	firmati	foil	0	Il Campionato del Tizio dei successi ed i scrittori , altronde se	f_contr_531
barche	barca	foil	0	Si possono con banda frullare detenute al circuito d' imputare ai fuochi nulli per i gatti , i concerti di	f_contr_532
debitori	debitore	foil	0	Possono solitamente opporre presso gli indagati concreti agrari tangenti scientifiche per determinate dimensioni , eccetera con la sinistra di	f_contr_535
notizia	notizie	foil	0	Le tasse sull' elmo magnifico e su ogni filosofia sono consigliate con	f_contr_539
regolamentari	regolamentare	foil	0	Nel cemento considerevole , la commissione estende che la votazione assegnata di un blocco sia , nel costantemente laziale pianeta	f_contr_540
disastro	disastri	foil	0	La colonna riporta i tassi in cui la fascia della marca neanche dispiace colatoio in	f_contr_542
cane	cani	foil	0	I MILIONI , le Riparazioni , le Servitù volontarie e le Costruzioni sono organizzatori alti con propri lettori ,	f_contr_547
sequenze	sequenza	foil	0	Lo Titolo comincia riabilitazione economica nelle regolari sbavature : a )	f_contr_550
fregi	fregio	foil	0	I Governi , le Colonne e le Servitù governative valgono tv coerente in elmo alla lente dell' angoscia e dello	f_contr_551
immagini	immagine	foil	0	I Diritti , le Costruzioni , le Sanità monotone e le Migliaia lavorano	f_contr_554
competente	competenti	foil	0	Per misurare lo reattore interessato , la tennista e la mortalità stradale , per rilassarsi gli ricercatori elettivi e	f_contr_557
giornata	giornate	foil	0	Il Convegno fascista può aprire la sfilata nei torrenti del Campionato della Parte mediante	f_contr_566
fetta	fette	foil	0	Il divorzio delle differenze costituzionali e la etnia di piovane Notizie nell' istante di una Clinica sono versati con	f_contr_569
denuncia	denunce	foil	0	La Revisione rampante vanta : sulle sedi pietose alla centralità particolar delle frasi e degli episodi , occorrenti	f_contr_571
esperti	esperto	foil	0	Le notizie di tentazione della Signora e le opportune ragioni potenti sono attribuite da ciascuna Spesa con mila salve basi ad	f_contr_574
Stato	Stato	foil	0	Con l' agricoltura in poligono della Cellulite il Tizio fisiologico dello Tizio acquista le attenzioni di	f_contr_576
Camera	Camere	foil	0	Per la settima assegnazione del Coordinamento il Thamsanqa è sostituito come	f_contr_578
alimenti	alimento	foil	0	La cognata dell' impegno duemila della Durata , per quanto dedica i predecessori aderenti che aspettano	f_contr_579
consuma	consumano	foil	0	Forse a quando neppure sia bevuto al moto e alla maglieria delle ragazzine umane fra gli ospedali forestali	f_contr_580
deve	devono	foil	0	Entro un immaginario dall' avulsione in rendimento della Bomba si	f_contr_584
coincidenza	coincidenze	foil	0	La distante Bomba è stuprata dal Convegno cubano dello Poligono entro mille modi dalla sua indagine da	f_contr_586
Stato	Stati	foil	0	Colpiscono : Il Convegno dell' Operazione Civile Isola Johnson Il	f_contr_587
battaglie	battaglia	foil	0	( trecento ) Le liquidità aventi tra le vigne e le sedute elettive associate dagli Democratici luoghi con vicedirettore alla	f_contr_588
aggiornamento	aggiornamenti	foil	0	Per la rampante scheda delle giornate di pericoli notevoli sul riconoscimento magnifico si possono infilarsi concerti gratuitamente strategici di	f_contr_589
conversioni	conversione	foil	0	Il legame massiccio è una delle libertà del settimo sovrappeso d' ispirazione per l' invio , intercettato con	f_contr_591
energia	energie	foil	0	( 6 ) Occorre istituire un quadro coerente per l' applicazione delle specifiche comunitarie per la progettazione ecocompatibile dei prodotti che consumano	f_contr_592
risposta	risposte	foil	0	( quarantotto ) La dilettante superficie è arrivata a mandare un ampio raddoppio di	f_contr_594
occupazione	occupazioni	foil	0	( zero ) Lo Convegno padiglione che richieda britannico vivere coincidenze mediorientali in prosa di	f_contr_595
fondo	fondi	foil	0	Appare notevole complessità per risarcire che tali sintomi siano ammazzati nella lunghezza dei matrimoni periodicamente trattandosi	f_contr_596
scatola	scatole	foil	0	( cinquecentomila ) Sebbene sia annuale un arbitro semplice alle castagne irregolari , la mutazione dei slalom a osso	f_contr_597
spiegano	spiega	foil	0	L' inesistenza di centimetri amministrativi avviene la comunità della mafia ,	f_contr_598
attenzioni	attenzione	foil	0	( quaranta ) Ai disordini della cooperativa di individui secchi o di ereditarie vetrate di	f_contr_601
innocente	innocenti	foil	0	( sedici ) La solare connessione dovrebbe integralmente riempirli l' associazione del concepimento di fascia	f_contr_603
guanti	guanto	foil	0	( nove ) È nell' edificio del paragone del bagaglio ecclesiastico spingere di prenotazioni avviate a	f_contr_606
porzione	porzioni	foil	0	Le salme tra la tradizionale pista e gli gesti melodici contenenti dovrebbero pronunciarci ad approfittarne il greggio attacco e a bilanciare	f_contr_608
