opt1	opt2	type	corr_opt	sent	full_id
resto	resti	foil	0	Inoltrandosi lungo il viale che adduce alla cappella , dove ancora si leggono	f_p3_211
segnala	segnalano	foil	0	ci si importa allegramente in contraddizioni invernali , produttive , destinate sufficienti eccetera dalla migratoria spinta che	f_p3_212
legislative	legislativa	foil	0	in convocazione con il rialzo , la definizione , il rilancio secondo un condomino barese che erge in severità la parata	f_p3_213
esplosioni	esplosione	foil	0	L' inosservanza mai è di quelle produttive perché si possa abbandonare uno consigliere d' apprendistato sull'	f_p3_214
future	futura	foil	0	Perché questo esistesse lo si riporta pagando le prestazioni della sua dichiarazione ,	f_p3_215
creò	crearono	foil	0	Un scopo fatalmente aderito dalla proprietà di Giorno Colorado ad Euskirchen , presso la quale	f_p3_216
estrema	estreme	foil	0	Ma a Fed e neanche ad Elvis o a Page Rowe propose la dinamica della sua	f_p3_217
esteriori	esteriore	foil	0	Per presumere il giorno da questo fratello , gratuitamente immediatamente	f_p3_218
riservato	riservati	foil	0	L' inammissibilità di queste rosse tinte ci consumano che Farinacci fu un mare	f_p3_219
tessere	tessera	foil	0	Ebbe un ballottaggio essenzialmente resistito dei propri voti , la sua delegazione ritmica ottenne la sua figlia , la sua	f_p3_220
sono	è	foil	0	Ma pure nel grande profilo che dispose sulla sua casa accanto alla Funicolare di Capri c'	f_p3_221
basi	base	foil	0	"Come neppure rilevasse , il sperimentale "" trasferimento "" dalla"	f_p3_222
addestrato	addestrati	foil	0	Mica vivono , nel ristorante , sfide bancarie , mandorle a colture belle , imprenditori gravi	f_p3_223
chimica	chimiche	foil	0	in lui rappresenti un calcolo di Séguin , un suggerimento di cuore Johnson , un' innovazione	f_p3_224
appuntamenti	appuntamento	foil	0	Mentre mica ti stupiresti di fronteggiare nella gioia di questo	f_p3_225
rare	rara	foil	0	""" L' infanzia ti compete al rinforzo dalla curiosità "" , è una delle sue ripercussioni"	f_p3_226
terzo	terzi	foil	0	Kharroubi , negli alti cantieri , aveva violato a ridurre strisce turistiche di pregiudicare nel	f_p3_227
diminuiscono	diminuisce	foil	0	A Karaburun , che durante una prostituzione celebra alle signore parimenti fisiche di lei ,	f_p3_228
testimonia	testimoniano	foil	0	Dalle carenze d' un complessivo sequestro , che ha aumentato edema improvvisamente nel padre di Margherita , aggiunge quello che Caritas	f_p3_229
timore	timori	foil	0	Altri minacciano affatto senza l' annullamento di quella percezione , ma preferisce rapidamente se l' eccezionale	f_p3_230
eroe	eroi	foil	0	si scrisse , infine , per dirvi scaricare tredici guide da	f_p3_231
attesa	attese	foil	0	Oh esclusivamente protetti - come l' affare di tragedia dalle	f_p3_232
piena	piene	foil	0	Nei pressi e nei decreti si è successivi comprare essenzialmente a una	f_p3_233
guardie	guardia	foil	0	E indubbiamente di potabile , nel notturno vapore d' uguaglianza bevuto dalla restituzione economica , sono stati sottovuoto	f_p3_234
secondi	secondo	foil	0	Spesso aveva accoltellato quel cervello che nemmeno si favorisce a unirsi	f_p3_235
esercizi	esercizio	foil	0	se Cooper avesse esaurito nella sua settima istanza , se la sua spettacolare accettazione d'	f_p3_236
contratto	contratti	foil	0	Gli Eugénie iniziarono la loro appropriata sufficienza raramente mila atleti dappertutto , il quindici	f_p3_237
concentrazioni	concentrazione	foil	0	A me , purtroppo gentile come partecipante , liberò che la priva prostituzione immediata con Ayrton di	f_p3_238
coordinato	coordinati	foil	0	""" Ma il sciopero è di chi se l' è dimostrato , neppure di chi l' ha"	f_p3_239
dichiarati	dichiarato	foil	0	Il forum di connazionali era di ultimissimo filosofo ed è stato provveduto dal risarcimento a capitalismo	f_p3_240
lezione	lezioni	foil	0	La Hussein ha rimesso la fattura che alla pianificazione si ricopriva apparsa dalla sua	f_p3_241
terapie	terapia	foil	0	Di questo decreto di occhi si è incorporata indietro la barriera difensiva sfruttando saldo alla	f_p3_242
tributario	tributari	foil	0	"Quasi Poe , dopo essersi ripetuto il "" Harvard Pc "" del"	f_p3_243
proporzioni	proporzione	foil	0	Disposizioni di boschi costruiti di muri , a Saddam Bari , distruggono ogni detenzione una lavorazione in galassia di vescovo che equivale	f_p3_244
termini	termine	foil	0	È la moglie grammatica ( o complessivamente , la classifica del	f_p3_245
corretta	corrette	foil	0	Io e Tennessee , quattro archi qui , abbiamo assolto una diaspora negativa	f_p3_246
locali	locale	foil	0	""" Penso un censimento quantomeno onesto - coordina l' istigazione - , per cinquanta amministratori ho destinato da liceo tra quest' accordo"	f_p3_247
camino	camini	foil	0	Una brava donna le incorpora lo fuoco , siede il	f_p3_248
trasferito	trasferiti	foil	0	Se Vatanen , trecento operatori , nemmeno avesse attivato questi violentatori di timone , che l' hanno	f_p3_249
fossero	fosse	foil	0	E domare che quando ho aggravato l' infezione di ricevere in soluzione uno schieramento che	f_p3_250
lettura	letture	foil	0	la finta della nostra collettività è svedese brevemente continuando dalla	f_p3_251
ricami	ricamo	foil	0	Sarà la disoccupazione di Coetzee o qui limitatamente un tavolo di corrispondenza , ma la Babe neppure è perfettamente interessante sul	f_p3_252
facessero	facesse	foil	0	"abilitazione dilettante , cose pulite , il dopo Marx ( "" chi se l' impediva che"	f_p3_253
dolci	dolce	foil	0	Perché Poettering il trapianto , nonostante che i ventiquattro assassini siano severi , risponde la geografica disoccupazione da erede puntuale ( ma	f_p3_254
inglesi	inglese	foil	0	""" To die For "" di Bihac Carney Plutarco , in cui aggiunge il trucco felice e degno dell'"	f_p3_255
famose	famosa	foil	0	mi esistono frammenti agricoli , con figlie da bracconaggio collettivo , retrovie	f_p3_256
compromesso	compromessi	foil	0	Colpiscono scatole metropolitane quando ti rappresenti del clandestinamente in un	f_p3_257
incrementi	incremento	foil	0	ci so ogni statua che mi pervade di valere in minerari	f_p3_258
musicale	musicali	foil	0	Siamo adibiti dal tifo di fiamma sui cerchioni alti a palestra del Ponzi realizzabile Tours Macciocchi , adeguatamente all' immaginario	f_p3_259
presentino	presenti	foil	0	mille ) Per l' annualità di formulare la foschia sui nazisti da una contestualmente argentina e neppure legalmente integrale festa che	f_p3_260
eccezione	eccezioni	foil	0	quarantotto ) Per i belli e rispettivi sequestratori di libertà che rappresenta il spettro in pressione , dove a un'	f_p3_261
verdi	verde	foil	0	"L' oasi sviluppa al bacino che , legittimamente , "" Nessuno può farle per decisamente di tremila riserve ai ricevitori"	f_p3_262
benefici	beneficio	foil	0	La medicina che da Giorgio sostiene al Slovenia dello Passera è viceversa pertanto presentata dal biglietto anteriore che succede in questo	f_p3_263
navigabile	navigabile	foil	0	Alle mie scatole di fette il presidente mi ha invaso uno lavaggio tra l' opportuno e il	f_p3_264
amministrativo	amministrativi	foil	0	Dietro guarda cuore volare in diploma e curare in un	f_p3_265
illeciti	illecito	foil	0	"E di missione , una cruciale "" televisione "" mica funziona per agire , o effettivamente per "" alleviare "" dal segnale"	f_p3_266
carenze	carenza	foil	0	Non nascondiamoci dietro un dito , ma abbiamo il coraggio di denunciare quali	f_p3_267
clandestino	clandestini	foil	0	ufficialmente che d' assai in album lei se ne copra bruscamente altresì e anzi per la sua espromissione ,	f_p3_268
consenta	consentano	foil	0	come chiunque si rechi negli eserciti dello campionato e della tartaruga , adeguatamente lei coordina disturbo che il suo simbolo mica	f_p3_269
scritte	scritta	foil	0	Infine la sua felicità , famoso Tom , è da un rito un decoro inosservato , che evolve la	f_p3_270
ape	api	foil	0	Tengo che questo consenta a perseguire un tecnicamente la sua solforica	f_p3_271
dichiarato	dichiarati	foil	0	Una poesia compiuta a un permanente miracolo con il governante del Springsteen , Macciocchi , il quale ha	f_p3_272
interferenza	interferenze	foil	0	Il Carlo si attribuì in una vegetazione tra Gennaro e Colombo eseguendo il cambiamento con ventiquattro genitori , finestrino preferibile dell'	f_p3_273
famiglia	famiglie	foil	0	Si riporta per valersi , si rispecchia per procedersi , perché le discussioni basano clamorosamente in	f_p3_274
incertezza	incertezze	foil	0	Quando una laziale signora se ne dipende , soltanto fuoripista ce n' desidera un' altra calda a sviluppare , all'	f_p3_275
generati	generato	foil	0	Soltanto in questi tempi , siano essi televisivi come quello	f_p3_276
tappe	tappa	foil	0	La nebbia che avvolgeva il maestoso Tourmalet dov' era fissato il traguardo della settima	f_p3_277
vetrina	vetrine	foil	0	Ultime a rimborsare il suo fischio indipendente ( ha ricevuto la miseria di cinquecentomila voli a ripetutamente zero di notte ) tremila	f_p3_278
prossimi	prossimo	foil	0	Perciò altrove c' sopravvive un accogliente errore nella presupposto abbastanza a Lee ( gorilla tredici ) ma il	f_p3_279
seduto	seduti	foil	0	Dopo aver colpito di dimenticare entrambi se neppure rispondono di recarsi , Napoleone ha	f_p3_280
incluso	inclusi	foil	0	Per calcolare Cia ha sceso formalmente Piramide di esaltare a ravvicinamento se vuole essere	f_p3_281
grigio	grigi	foil	0	C' promette la mortale fila che Mann abbia voluto eliminare un momento ai	f_p3_282
mestieri	mestiere	foil	0	Mi intervengo di spostare ma , cercando che siamo nell' obbiettivo infelice e accusando come Harris ha eretto il	f_p3_283
reazione	reazioni	foil	0	Ho praticato in diverse abitazioni le sue clausole , le sue infezioni , le sue	f_p3_284
obbligo	obblighi	foil	0	L' ampliamento rilassato ha dimostrato diversi impianti , tenuti alcuni	f_p3_285
tragedie	tragedia	foil	0	In un legislatore altissimo , con duecentomila o tre vedute in	f_p3_286
influenze	influenza	foil	0	Proprio in una stagione così delicata ci troviamo con un designatore la cui	f_p3_287
tornerà	torneranno	foil	0	Una geografica manodopera durerà di esserci Doctor ( differente economista di Conrad ) per rompere il convegno e si	f_p3_288
funge	fungono	foil	0	Insieme , o Verdi tira liberi riscontri a Trento o lo	f_p3_289
risiedono	risiede	foil	0	Quello collocato dall' ambizione per saltare Lucy ( formando settanta sperimentazioni ) è coniato sperare un vespero che mica si	f_p3_290
africane	africana	foil	0	attentamente Jesus Prodi ( nella comunità ) , l' attrice disperata del simbolo a Sharm e	f_p3_291
periodi	periodo	foil	0	Da ancor la sorprendente naturalista , terza denominazione ottimistica a risolvere un	f_p3_292
privato	privati	foil	0	L' emissione limitata dal rialzo Vettel è stata di trecento	f_p3_293
processuali	processuale	foil	0	Da dapprima è preso l' arresto seguente dell' inventore che ha soddisfatto in trenta tenendo il cannone tardi	f_p3_294
elogi	elogio	foil	0	Tiro è stato al sottofondo quaranta contraddizioni riportando una tristezza bosniaca da partenariato , al di solitamente dei suoi dieci	f_p3_295
furto	furti	foil	0	Ora ivi la foschia è stata ripetuta dalle delusioni , straordinariamente regolarmente linguistiche solitamente contemporaneamente pericolose a un	f_p3_296
ritardi	ritardo	foil	0	Adesso che certi problemi sembrano superati , rimane loro il dovere sacrosanto di rispettare la fatica dei concorrenti senza quei crudeli	f_p3_297
distribuzione	distribuzioni	foil	0	Dal redditizio impegno Stefano - Pubblica pancia ordinaria , molecolare e spaziale come la vendita per poliestere , come la	f_p3_298
formati	formato	foil	0	"E oramai quelle se lo muoiono complessivamente quando muove di averci diminuito "" specialmente di estendere dal"	f_p3_299
fatti	fatto	foil	0	""" Il dio per la razza di Sherlock Fernando e un """	f_p3_300
bandiere	bandiera	foil	0	plankton al suo recupero , publishing a Robson , Guggenheim Igman perisce in quinta	f_p3_301
avvengono	avviene	foil	0	È questo il segmento turco che si muove pesciolino prioritario , che	f_p3_302
bilanci	bilancio	foil	0	E Grecia Malcolm ampiamente suonava la sua carta con meccanismo , ottenendo gli eroi come ci si impone il	f_p3_303
provocato	provocati	foil	0	Mica desidero se mi ritengo tutta questa sintesi , ma ho	f_p3_304
mercati	mercato	foil	0	Sasea Dermatrophine - inoltre chiesto in sondaggio dalla candidatura , da un carcere inventato quando avveniva una sfiducia al	f_p3_305
messaggi	messaggio	foil	0	Mica s' è tradotto per gamba Lamberti Super , e sì che ritrae da quando avveniva quarantotto echi e	f_p3_306
famiglia	famiglie	foil	0	Oggi che quel bimbo è campione del mondo , una	f_p3_307
rotte	rotta	foil	0	Sempre ha soprannominato lo storico Kademi e il lussuoso Capitale , micron quarantotto della piattaforma di infine , con quella	f_p3_308
rappresentato	rappresentati	foil	0	I centimetri differenti autonomi , viceversa di Nirvana e Ruth , sono stati	f_p3_309
vettura	vetture	foil	0	ai Henin cinquanta , nei settanta , la pensione venne lasciata a zero scrupoli dalla decorazione per Frasca e Harvard , in	f_p3_310
iniziano	inizia	foil	0	Anche , di infartuati ne mette ecco quindici , uno ai duecentomila copioni che	f_p3_311
accertamento	accertamenti	foil	0	Senza tassi perché Blackfriars CEE ( ma sì , come Bush Dory , suo	f_p3_312
interessata	interessate	foil	0	""" Se si mancano marcire da un gennaio come me , formino filosofo "" viveva il passaggio del costume , utilizzando l'"	f_p3_313
ponti	ponte	foil	0	un scenario obbligatoriamente inferiore ai quattro per registrarsi , magistratura per	f_p3_314
ordinanza	ordinanze	foil	0	La somministrazione in considerazione ideologica , ecologica di commozione , smentisce all'	f_p3_315
borse	borsa	foil	0	Il sbarco Popolazione Euroclub , l' alleggerimento idrogeologico che l' ha concessa quaranta artigiani particolarmente trasformandoli di indicare la	f_p3_316
ore	ora	foil	0	L' improvvisato collegamento con la moglie ripaga Iapichino di un quarto d'	f_p3_317
verso	versi	foil	0	In emendamenti questo è maresciallo , come Selex ha salvato nel	f_p3_318
avevo	avevamo	foil	0	""" Saltavo per soprattutto ed essendomi commentata separatamente in scrittrice"	f_p3_319
campagna	campagne	foil	0	Nemmeno ho magari deliberato al rapido e sono stata valida della	f_p3_320
anziano	anziani	foil	0	puntualmente è stato rischiato da un cinquemila intrapreso con troppo radiotelemetro e che nemmeno passa notevolmente il suo funzionario	f_p3_321
esportazioni	esportazione	foil	0	Inoltre era fusto che raggiungesse ben e alla stagione si era avvenuto che l'	f_p3_322
prime	prima	foil	0	Seconda un' elettrica fortuna , la Caserta ( settanta ) ,	f_p3_323
campi	campo	foil	0	Ora il Castiglioni costringe a Milosevic in Stoccolma lentamente verrà nominato l' eccessivo pizzico principalmente dei	f_p3_324
famiglia	famiglie	foil	0	""" Le rumorosità hanno istituito in poco passeggero cinque muri , fornendo la"	f_p3_325
sospette	sospetta	foil	0	Il mezzogiorno è talmente gigantesco , virtualmente gli attentati avevano insegnato recitare in manodopera fortemente risolutiva e	f_p3_326
vita	vite	foil	0	Per elicotteri ha incentrato anche la bandiera effettiva , necessariamente l' elenco cinematografico ha coniato di aggiungere a quella intellettuale dunque la	f_p3_327
severo	severi	foil	0	In legittimazione con Team , Alma è stato staccato da Fresi che ha leggermente accompagnato per risultare	f_p3_328
visto	visti	foil	0	Ma neppure copro se ce la visualizzeranno , ricevuto come hanno	f_p3_329
designazione	designazioni	foil	0	Si regala di una disambiguazione nascosta a chi è stato vicepresidente della	f_p3_330
prospettive	prospettiva	foil	0	Il suo grasso è straordinariamente ovvio e i depositi sono ovunque al lenzuolo firmato dalla Tremaglia nelle acide	f_p3_331
tenore	tenori	foil	0	E neppure mantiene che la gentile assistenza fra Tito e Sung possa mangiare talvolta il	f_p3_332
tessili	tessile	foil	0	Trito che nessuno possa presentare in trappola la mia opportunità e la mia priorità , mi prepara attivamente	f_p3_333
sogno	sogni	foil	0	Innanzitutto ci collegano panda per il trattino e per la Blanc che saltano	f_p3_334
tratta	trattano	foil	0	L' Indipendenza accende a tutto Yasser e dipende allora Legambiente Alfredo	f_p3_335
corre	corrono	foil	0	Dal nostro inviato Salerno - Non salta sulla statua della libertà e non	f_p3_336
brillante	brillanti	foil	0	metallo ragionato da Henin , con AWACS e Fama a rivedere sorprendentemente il	f_p3_337
prete	preti	foil	0	le quindici caserme sono incontrate in pattern e Kidman ne ha calato un diciottesimo , su	f_p3_338
scatole	scatola	foil	0	cinquemila elementi sul cacao del sport , nel trasmettitore sul significato	f_p3_339
dollaro	dollari	foil	0	mila le bordure avviate all' attimo di Indiana al Cannes persino fu ammessa una pizzeria interessante realizzata fra gli altri accuratamente dal	f_p3_340
versioni	versione	foil	0	""" Subito - finanzia Laurent - è convincente integralmente la"	f_p3_341
clandestina	clandestine	foil	0	Metto duramente che per quel campo , la Shake sarà perfettamente cattiva con le	f_p3_342
frutto	frutti	foil	0	Se tutto dichiara come facciamo e se tutte le fogne croate effettuano con convegno di sommità , i primi	f_p3_343
sogni	sogno	foil	0	Seduta dallo museo una discussione ha pubblicato il seno fortunatamente che , al	f_p3_344
operazioni	operazione	foil	0	L' abuso ha fidato che dopo la crema jugoslava , Berlino lo ha proclamato ferendone di avere rassicurato	f_p3_345
scarti	scarto	foil	0	Lupa , cinicamente si rende il territorio , è un ballatoio della Dichiarazione Pubblica dell' appuntamento Lula di Boulevard e	f_p3_346
esposte	esposta	foil	0	"GSFC Domenico Mladic , macchinista della "" Eliot "" , una emancipazione di frase velocemente"	f_p3_347
statistico	statistici	foil	0	Adesso hanno sentito i profitti del smaltimento sui quali era stato affermato il vapore	f_p3_348
nonni	nonno	foil	0	Sempre di restarsene l' attentato unitamente lento di galera , i controllori hanno dovuto sapere per undici scrittrice di	f_p3_349
obiettivi	obiettivo	foil	0	Per citarne l' estate di cuoio era stato condotto ufficiosamente l'	f_p3_350
meteorologiche	meteorologica	foil	0	Bob - Quasi del murales ricevuto ovviamente da un taglio , una	f_p3_351
ministro	ministri	foil	0	Un costante succo , pensato da quattro signori italo da tre fiori ciascuno , lascia sorprendente al	f_p3_352
unione	unioni	foil	0	Il poeta è consueto , insomma ci svolgono molte agricole	f_p3_353
territoriale	territoriali	foil	0	"Troppo l' umana preoccupazione scientifica è che il lino mica è qualvolta """	f_p3_354
uomini	uomo	foil	0	La morte , hanno accertato poi i medici , è stata causata da un incidente nel quale l'	f_p3_355
fermi	fermo	foil	0	Trattamenti urgenti altronde per Ue Jean , una bara fresca di settanta appelli , voluta il quarantotto	f_p3_356
falsa	false	foil	0	Per pesciolina , lungo il getto , una burocrazia di modello Gus , di quello terribile , con fortunatamente ammessa una tartaruga	f_p3_357
assegnato	assegnati	foil	0	"Mica c' riceve regime "" , frega Juve Berger che quest' elenco tra colposo e festivo ha"	f_p3_358
teatro	teatri	foil	0	Si trattava dell' ammissione di un portiere di cinquanta , sedici	f_p3_359
riconoscono	riconosce	foil	0	Nemmeno mi racconta , mica mi cerco talvolta di niente -	f_p3_360
variabili	variabile	foil	0	Sì , è dimezzato , a Chrysler c' combina molta	f_p3_361
carichi	carico	foil	0	"Disposizioni , musulmani , fuga , idolo etnografico e attivamente , nella collettività della "" Cattaneo che significa "" , apparentemente i"	f_p3_362
porto	porti	foil	0	Le azioni fornite al naturalistico prestito della questione della colonna che avrebbe percepito salotto giustificano sgombrare come riflessione al	f_p3_363
documentazione	documentazioni	foil	0	Nemmeno è negativo se quest' alpino angolo di intrigo riuscirà la concorrenza della	f_p3_364
fresche	fresca	foil	0	Sono gli allegati esercitati , per celebrare il dibattito della serata	f_p3_365
campionato	campionati	foil	0	Dalle duemila , quando la sera è stata causata per vincitore dal	f_p3_366
intraprese	intraprese	foil	0	Nella mirra di menzione Galles Fujimori le punte sono calcolate	f_p3_367
figlia	figlie	foil	0	""" Una pausa in Aosta , vi devo massimizzare necessarie"	f_p3_368
attenti	attento	foil	0	Per il periodo di Cen , la convenienza , i referenti , il traguardo è stato	f_p3_369
spiegazioni	spiegazione	foil	0	Fernando gli risolve prenderli le barricate , il serpente con gli esperimenti e quello con le piogge , le	f_p3_370
bambino	bambini	foil	0	La requisizione di Shinjuku , che dispone i scoppi al clamore in	f_p3_371
convoglio	convogli	foil	0	Un scacchiere che ogni dio giura scrivere il contributo a tanti	f_p3_372
prime	prima	foil	0	un negozio del fiero scenario a euro di Gil ha ragionato unicamente piazze successive all' attribuzione dal caso Amnesty , alle	f_p3_373
aspetta	aspettano	foil	0	""" È una vergogna - commenta senza mezzi termini Cinzia Zucaro , una signora che da venti minuti"	f_p3_374
antico	antichi	foil	0	""" Le nostre sperimentazioni , altamente quelle fumée , mica possono cancellare a storicamente di cento sottopagati"	f_p3_375
contiene	contengono	foil	0	Oltre una medica gravità c' riflette totalmente da sfogliare sull' ingombro perché la potenza neppure	f_p3_376
erede	eredi	foil	0	""" Il respiro neanche svolge frequentemente per il protagonista , ma intanto per l'"	f_p3_377
cellula	cellule	foil	0	E Daverio Irving nella quarta , ferita , consapevolezza di arredo si è portato la	f_p3_378
fallimenti	fallimento	foil	0	Con una pallida schiuma , death al riscontro magnifico di un suo sospiro fan , il canone si è richiesto di	f_p3_379
fenomeno	fenomeni	foil	0	È abrogato al strutturalismo mentre presta l' opuscolo distante e Marco , il rigorosamente	f_p3_380
duro	duri	foil	0	Anzi indigeni e riflettori di proliferazione si includono per studiare che vogliono piangere uno collegio all' acido del punteggio dilettante ospitato di	f_p3_381
affermazioni	affermazione	foil	0	La lampadina Medio , qui rossa e necessariamente tarda di	f_p3_382
firma	firme	foil	0	C' torna un risarcimento tipicamente di strage - e attualmente questa è una	f_p3_383
zone	zona	foil	0	i quartieri , quindi , non sono deserti come nelle	f_p3_384
specifiche	specifica	foil	0	attivamente verso l' andatura si sono fuggiti assassini al campionato d' angelo dell' AWACS a Maxwell , attualmente se in cellula	f_p3_385
coincidenza	coincidenze	foil	0	sulle sedi del Cruise i frammenti dovrebbero essere colpiti da una	f_p3_386
deliberazione	deliberazioni	foil	0	Gazidede , ecco , ha studiato ai frigoriferi di costituire impiantare da trame e	f_p3_387
varo	vari	foil	0	Forse sufficientemente , sette dei negozi , uno noto e l' altro lussuoso secondo la compagnia del	f_p3_388
libici	libico	foil	0	Come ogni accesso la sosta darà scoppiare una Sharm ma il massacro del scandalo viene coinvolto temporaneamente	f_p3_389
capo	capi	foil	0	""" Le unioni potevano essere tolte in un islamico giuramento , davvero valido , se potenzialmente si fosse riuscito un"	f_p3_390
spalle	spalla	foil	0	Settanta le fasi mantenute dalla vacanza mentre erano amministrative a garantire con emissioni che consideravano riforme da diverse guardie di	f_p3_391
riferimento	riferimenti	foil	0	Intanto a loro , sono state contraffatte altre quarantotto soluzioni che facevano il	f_p3_392
affari	affare	foil	0	E peraltro che è ripetuto in momento Boulevard Shimon Senna , cento	f_p3_393
funzionario	funzionari	foil	0	Figlio di un elettromeccanico di Lugano , spera in un futuro di militare di carriera o di	f_p3_394
capisaldi	caposaldo	foil	0	Le rispettive quattro importazioni è furbo , ma temporaneamente se spinge classe e nemmeno ci manifestano	f_p3_395
fiore	fiori	foil	0	"VINCONO ad occupare un "" cioccolato "" che neanche cade i quarantotto"	f_p3_396
segmento	segmenti	foil	0	""" Sì , sufficientemente se qualcuno risponde il strano e neppure piove in meraviglia all' ipocrisia di valanga dei"	f_p3_397
scelte	scelta	foil	0	Ognuno di noi si è arrivato un pontefice di vendere tornare un premio con la	f_p3_398
teatri	teatro	foil	0	Era un drammaturgo per tagliare l' uomo del soffitto , in circoscrizione d' incredibili	f_p3_399
olimpica	olimpiche	foil	0	Il Lys della Bandiera Pubblica fu sconfitto nel dieci , all' editoria della miglior trazione quotidiana della Molfetta	f_p3_400
meteorologiche	meteorologica	foil	0	nell' interrogativo un apogeo che nemmeno potrebbe congratularmi rigorosamente la	f_p3_401
autori	autore	foil	0	In questa chitarra , cento domestici tribunali da spunto con	f_p3_402
corpo	corpi	foil	0	Alla forza è considerata altrove la tappa ambientale , all' albergo , con idrauliche scrivanie a	f_p3_403
politico	politici	foil	0	"Il fatto di ballare allacciati fa del valzer un "" simbolo social -"	f_p3_404
parenti	parente	foil	0	In studentesse private , si sembrava del cunicolo temporaneo , che regnava i	f_p3_405
villaggi	villaggio	foil	0	"È sorprendentemente innovativo rivedere tredici bottiglie sul cammino di questo """	f_p3_406
ricchi	ricco	foil	0	A costringere dal quaranta , costoro fornirono su sette disturbatori di Taormina dei cavalli contrari che includevano come rappresentante il bue	f_p3_407
formule	formula	foil	0	Era il calcolo del maestoso primo peculato , che torna una libica	f_p3_408
giovani	giovane	foil	0	Le previsioni vivono da prenderne , il divorzio fornisce l' unità del momento e festeggia sottovuoto attentamente uno lavaggio	f_p3_409
fresco	freschi	foil	0	La transizione è conseguenza di un direttore separatamente temporaneo e	f_p3_410
dipinte	dipinta	foil	0	Qualche realtà la morsa tra duecentomila archivi è certamente scellerata e ciascuna delle sue eredità è	f_p3_411
presenze	presenza	foil	0	Ogni menu , all' asta dei primi criteri , gli interessi operano la	f_p3_412
passaggi	passaggio	foil	0	Quest' elica è incorporata se si interessano i prossimi vani sorprendenti , trucidati da	f_p3_413
