opt1	opt2	type	corr_opt	sent	full_id
riservati	riservato	foil	0	La sfera della Documentazione è il prestigio equo : mortale , sconosciuto e	f_p3_820
piloti	pilota	foil	0	In frutti arbitrali di possibilità ed abilitazione , installati raramente dalla maratona , l' autenticità di Pubblica xenofobia può impedire	f_p3_821
disposizioni	disposizione	foil	0	La sostenibilità e la folla della lettura e di ogni accessoria	f_p3_822
richieste	richiesta	foil	0	La loro decisione può accedere perfettamente per orecchio contiguo dell' Autorità rapida con le frequenze vendute dalla	f_p3_823
stabilito	stabiliti	foil	0	Per le detenute , infine in discapito atmosferico al campo , nemmeno è	f_p3_824
cause	causa	foil	0	Tutti conoscono confine di lanciare frequentemente il proprio finestrino con la spinta , lo cuoio e ogni onesto soldato di	f_p3_825
costumi	costume	foil	0	Sono vietate le pubblicazioni a stampa , gli spettacoli e tutte le altre manifestazioni contrarie al buon	f_p3_826
informatore	informatori	foil	0	Tutti possono aumentare in tenore per la contraffazione dei propri musulmani e	f_p3_827
frutti	frutto	foil	0	Sono avviati ai neppure inutili , con antichi apparati , i	f_p3_828
attestata	attestate	foil	0	Nessuno può essere provato se mica in trappola di una certezza che sia	f_p3_829
tratto	tratti	foil	0	Le tragedie neanche possono festeggiare in regali preziosi al desiderio di imprevedibilità e devono rimborsare alla categoria del	f_p3_830
generale	generali	foil	0	La vita aiuta ai dettagli lasciati naturalmente del pizzico ogni carenza belga e	f_p3_831
catastrofe	catastrofi	foil	0	La remissione compie le parole e i rapinatori per la	f_p3_832
compresa	comprese	foil	0	La Durata riferisce la maestria come puntuale sovrappeso dell' attacco e importo della serenità , e gestisce foglie	f_p3_833
asino	asini	foil	0	L' accessione e la documentazione sono future e tragico ne è l'	f_p3_834
passeggiate	passeggiata	foil	0	È costretto un accordo di Trasferimento per l' altezza ai grati oggetti e cardinali di	f_p3_835
ha	hanno	foil	0	Le istituzioni di alta cultura , università ed accademie ,	f_p3_836
umana	umane	foil	0	L' antenna inferiore , avvenuta per originariamente undici accessori , è	f_p3_837
dipendente	dipendenti	foil	0	Il maresciallo realizza collasso ad una cornice bianca alla centralità e pubblicità del suo cemento e in ogni scetticismo	f_p3_838
etnica	etniche	foil	0	Le compagne di sangue devono salvaguardare l' invio della sua incontrollabile sterilizzazione monumentale e avanzare alla borgata e al tesoro una familiare	f_p3_839
rifugiato	rifugiati	foil	0	Mica può riequilibrare in capitalismo con l' enfiteusi spaziale o in	f_p3_840
aumenti	aumento	foil	0	La performance relativa è trasportata e cominciata dalla sala , che ne prevede i stagni di	f_p3_841
alimenti	alimento	foil	0	A generi di incompatibilità differente la sigla può liberare appositamente o smettere , mediante arma e salvo	f_p3_842
modifiche	modifica	foil	0	Tutti i deputati scelgono sottosuolo di introdurre gradualmente in contrabbandieri per tener con discorso fantastico a calare la	f_p3_843
tributario	tributari	foil	0	Tutti i tipi dell' uno o dell' umanitario coordinatore possono interrogare agli inganni	f_p3_844
appartenenti	appartenente	foil	0	La retribuzione può , per l' esportazione ai belli avvenimenti e alle lacrime israeliane , scaricare ai spartiti gli appelli neanche	f_p3_845
necessari	necessario	foil	0	Chi è chiamato a funzioni pubbliche elettive ha diritto di disporre del tempo	f_p3_846
Camera	Camere	foil	0	Tutti i scambi succedono il parlamento di essere satellitari alla	f_p3_847
massacrato	massacrati	foil	0	I benefici cui sono andate commissioni quadrate soffrono il cuscinetto di ironizzare con nonna ed impiego , cambiando simbolismo nei beni	f_p3_848
colloquio	colloqui	foil	0	Il Campionato si sogna in chiesa teatrale dei contributi delle duemila Locazioni nei pericolosi	f_p3_849
maschi	maschio	foil	0	La Documentazione dei trasferimenti è assicurata a clima efficace e	f_p3_850
inventato	inventati	foil	0	Il dettaglio dei scudi è di cinquecentomila , sessanta dei quali	f_p3_851
decoro	decori	foil	0	La crociera dei creatori tra le disposizioni , proclamato strano il balzo dei	f_p3_852
atomiche	atomica	foil	0	La piscina dei creatori fra le Migliaia , conferito greco il sacrificio dei scontri attesi alla ragazza Avon , materna	f_p3_853
quarto	quarti	foil	0	Sono eventuali a temi gli imputati che hanno visitato il	f_p3_854
fili	filo	foil	0	Il Settore della Comunione può fissare poliziotti a vigilia quattro colloqui che hanno affidato la Spesa per altissimi	f_p3_855
precedente	precedenti	foil	0	Finché non siano riunite le nuove Camere sono prorogati i poteri delle	f_p3_856
Stati	Stato	foil	0	Quando il Dipartimento si vince in pavimentazione forestale , il	f_p3_857
giornata	giornate	foil	0	Le procedure di ciascuna Parte e del Sodio mica sono sotterranee se mica è mentale la	f_p3_858
racconta	raccontano	foil	0	I missili del Regolamento , integralmente se neppure seguono visita delle Spese ,	f_p3_859
dottori	dottor	foil	0	Ogni barbone di ragione , praticato ad una Durata è , secondo le ragioni del suo	f_p3_860
aspirazioni	aspirazione	foil	0	Il trucco prescrive pianoforti acuti per i minuti di geografia dei quali è legata l'	f_p3_861
punti	punto	foil	0	Può unicamente chiedere in quali sostenitori e braccia l' inventore e l' utilizzazione dei	f_p3_862
ricostruzioni	ricostruzione	foil	0	La rete colturale di appalto e di ondata tipografica da	f_p3_863
titolari	titolare	foil	0	Se le Notizie , ciascuna a votazione estetica dei propri	f_p3_864
esami	esame	foil	0	È obbligato sovrappiù maschile per scommettere l' alternativa , sensibile o deplorevole , di una rilevanza o di un	f_p3_865
vento	venti	foil	0	L' edificio della convergenza sommersa neppure può essere premiato al Sodio se nemmeno con conversione di livelli e	f_p3_866
idroelettrica	idroelettriche	foil	0	Il Diritto neanche può , senza semplificazione delle Disposizioni , estendersi pianoforti che applichino margine di popolazione	f_p3_867
consegnati	consegnato	foil	0	I depositi scorrono accettazione relativamente dall' inventore , se neppure sono	f_p3_868
massacrato	massacrati	foil	0	Le Migliaia possono chiaramente ravvedersi con rinunzia i commentatori sfortunati versati sulla gamma dei controlli neppure	f_p3_869
periodiche	periodica	foil	0	La globalizzazione di udienza festeggia alle orbite e agli artigiani con gli contigui piani e le	f_p3_870
punta	punte	foil	0	All' accettazione permettono quaranta salti per ogni Sezione espressi dal Giorno prevalente in dialogo che sia uccisa la fetta delle	f_p3_871
Repubbliche	Repubblica	foil	0	Settanta biografi straordinariamente che parli il costo , il Divieto della	f_p3_872
vengono	viene	foil	0	Se le Costruzioni sono presentate , o riempie validamente di mille glutei alla loro pancia , la irritazione	f_p3_873
Stati	Stato	foil	0	Le fiale del Settore della Clinica , in ogni nomignolo che egli neppure possa ovviare , sono associate dal Coordinamento del	f_p3_874
Presidente	presidenti	foil	0	In caso di impedimento permanente o di morte o di dimissioni del	f_p3_875
Repubbliche	Repubblica	foil	0	Appare e conduce i valonesi nulli , trasmette i chioschi ormonali , scarsa , quando intervenga , l' igiene delle	f_p3_876
secondo	secondi	foil	0	Dipende il trasferimento delle Riparazioni alzate , descrive il Regolamento sinistro di memoria manipolato secondo la sostituzione , registra lo	f_p3_877
Stato	Stati	foil	0	In tali studi è schiacciato in marito di industria dal	f_p3_878
milanese	milanesi	foil	0	La salvezza esclude l' esperienza dei cinque Obblighi e dei loro	f_p3_879
improvvisati	improvvisato	foil	0	La crema segue un ovest ovvio e imprenditoriale da ogni	f_p3_880
imprenditore	imprenditori	foil	0	Nemmeno possono , finché sono in degradazione , essere effettuati negli	f_p3_881
accuse	accusa	foil	0	Numerose le superfici del Dipartimento miglior della vasca , riconoscono al Costo della bara l'	f_p3_882
crociera	crociere	foil	0	La meraviglia si emerge mediante il difettoso giocatore situato dalla	f_p3_883
locale	locali	foil	0	Nel dettaglio paragonabile , la licenza aiuta che la magia assassinata di un tiro sia , nel lentamente vergine deterioramento	f_p3_884
hanno	ha	foil	0	La legge regola i casi in cui la formazione della prova non	f_p3_885
affermati	affermato	foil	0	Contro le mensole e contro i cerchioni sulla priorità plausibile , coinvolti dagli agenti semplici appositi o totali , è ferocemente	f_p3_886
vicenda	vicende	foil	0	Si può garantire a tale rovina fuoripista per le stelle dei progetti danesi in torrente di	f_p3_887
biblioteche	biblioteca	foil	0	Tale piazza rurale nemmeno può essere avvolta o diventata a sessuali brevetti di anarchia o per determinate	f_p3_888
secoli	secolo	foil	0	La rotta chiama quali aggiornamenti di pianta possono indagare gli episodi della finnica inchiesta nei	f_p3_889
formato	formati	foil	0	La solidarietà migratoria è emanata dallo Comitato e dalle Costruzioni nel	f_p3_890
conseguenze	conseguenza	foil	0	Nelle motivazioni di miseria singolare procede alle Ricerche la proprietà previa , recentemente che per la	f_p3_891
critica	critiche	foil	0	Resta alle Provincie la facilità finnica in potenziamento ad ogni palla neppure essenzialmente cresciuta alla	f_p3_892
ufficio	uffici	foil	0	Le commissioni personali riuniscono ogni istante che accompagna la pallida serenità degli	f_p3_893
arance	arancia	foil	0	I Terreni , le Migliaia , le Sanità pericolose e le Locazioni raccontano	f_p3_894
costituzioni	Costituzione	foil	0	Stabiliscono e applicano tributi ed entrate propri , in armonia con la	f_p3_895
acquirenti	acquirente	foil	0	La ragione dello Regolamento arriva un collo scientifico , senza quadri di commozione , per i caratteri con minor dc stradale per	f_p3_896
Stati	Stato	foil	0	Le sorelle luccicanti dalle posizioni di cui ai nomi funzionali scelgono ai	f_p3_897
frequentano	frequenta	foil	0	I Vincoli , le Riparazioni , le Sanità nocive e le Cose	f_p3_898
pezzo	pezzi	foil	0	La panchina frega le missioni appropriate a soddisfare che i vertici falsi siano elencati nel storicismo del compenso di reciprocità e del	f_p3_899
errata	errate	foil	0	Il Sabato fatale indigna le marijuana romane erette alla Clinica e le	f_p3_900
Consiglio	Consigli	foil	0	Il bacino di alternativa e i stagni di età e di attualità del	f_p3_901
tradizioni	tradizione	foil	0	I frammenti difficili mica possono essere sballottati a soffrire delle apparecchiature eseguite e dei spessori dedicati nell' origano delle loro	f_p3_902
sociali	sociale	foil	0	Ciascuna Base ricorda uno membro che , in interpretazione con la Neve , ne vieta la relazione di veicolo e i tributi	f_p3_903
milanesi	milanese	foil	0	Lo progetto è acquistato e fallito dal Colpo pesante con fonte infilata a vergogna elettrica dei suoi	f_p3_904
governi	Governo	foil	0	Per tale legge non è richiesta l' apposizione del visto da parte del Commissario del	f_p3_905
soggetti	soggetto	foil	0	Lo passeggero è contato a festival cinese qualora entro cinque	f_p3_906
riconoscibile	riconoscibili	foil	0	In ogni Madre , lo simbolismo ripete il Coordinamento delle acque	f_p3_907
svizzero	svizzeri	foil	0	Con matrimonio generato del Tesoro della Parte sono volati lo	f_p3_908
terzi	terzo	foil	0	Il Scarico crescente può approvare la cattedrale nei tassi del Titolo della Spesa mediante prescrizione solforica , conosciuta da arbitrariamente un	f_p3_909
adibito	adibiti	foil	0	L' influenza della guerra di mamma nei poliziotti del Costo della Domenica	f_p3_910
Consigli	Consiglio	foil	0	In ogni rilievo i gassosi avvisi rovinano alle proporzioni tropicali della giornata dei docenti il	f_p3_911
sperimentali	sperimentale	foil	0	Si può , con connessione prevalente , fuggiti i Servizi	f_p3_912
Camere	Camera	foil	0	Si può , con l' esplosione della notte delle riparazioni della	f_p3_913
Repubblica	Repubbliche	foil	0	Il risarcimento delle telecomunicazioni decisionali e la andatura di mezze	f_p3_914
Presidente	presidenti	foil	0	La Corte costituzionale è composta di quindici giudici nominati per un terzo dal	f_p3_915
grammatica	grammatiche	foil	0	I riferimenti della Baia permanente sono trasportati tra i creditori affatto a concetto delle	f_p3_916
romanzo	romanzi	foil	0	I nazisti della Guerra gentile sono costruiti per tre oneri , gravanti per ciascuno di essi dal tributo del	f_p3_917
impressionante	impressionanti	foil	0	Quando la Somministrazione ferma l' irregolarità pesante di una convergenza di moglie o di individualismo	f_p3_918
africano	africani	foil	0	La veduta della Bandiera è definita e sentita alle Centinaia ed ai Trattamenti tropicali	f_p3_919
Regione	Regioni	foil	0	Nemmeno si preferisce consigliere a factotum se la sede è stata emessa nella quarta persecuzione da ciascuna delle	f_p3_920
attrezzature	attrezzatura	foil	0	Con l' armonizzazione in fanatismo della Basilica il Scarico suddetto dello Convegno annuncia le	f_p3_921
forme	forma	foil	0	Al lungomare di essere congelati bambini si può farla fatalmente della produzione del coronamento di	f_p3_922
Regione	Regioni	foil	0	Le eccezioni dei Consorzi comunali e degli eserciti edilizi delle esperienze supplementari sono acquisite entro un occidente dall' attuazione in rumore della	f_p3_923
Stati	Stato	foil	0	Spese della Traduzione svolgono il debutto alle Ricerche di procedimenti e valonesi dello	f_p3_924
nomi	nome	foil	0	I predicati di quelli esistenti prima del 28 ottobre 1922 valgono come parte del	f_p3_925
droga	droghe	foil	0	l' Ordinamento stretto è dimesso come opuscolo automatico e comprende nei muscoli convertiti dalla	f_p3_926
mano	mani	foil	0	Entro un autore dall' iguana in faro della Domenica si toglie alla cura e al procedimento con essa delle musicali	f_p3_927
zucchero	zuccheri	foil	0	Clausola ventun / ventisei / Tiziano del Coordinamento Europeo e del Trasferimento del quattro	f_p3_928
consumatore	consumatori	foil	0	Il pizzicotto idrogeologico e il televisore dell' Arafat Ucraina , costretto il	f_p3_929
produttore	produttori	foil	0	Per la probabile scenografia delle medicine di progetti veloci sul parametro disastroso si possono accecare	f_p3_930
diverso	diversi	foil	0	Nell' immigrato dello mestiere potente , dovrebbe essere abbattuto il vizioso assedio dell' inventore esteriore	f_p3_931
bellezza	bellezze	foil	0	( quaranta ) La remissione annua dei compensi gode un finanziamento insostenibile della gomma polacca sulla	f_p3_932
enorme	enormi	foil	0	( mila ) Il regalo dell' onda immediata - una delle cui aziende recenti è l' aeromobile rigorosamente	f_p3_933
terre	terra	foil	0	La permanenza di enfasi è quella che detiene la migliore pentola tra le	f_p3_934
europeo	europei	foil	0	Una significativa riduzione del consumo di energia , come suggerito dalla Commissione nel programma	f_p3_935
adesioni	adesione	foil	0	Il pulsante sanguigno è una delle dignità del primo computo d'	f_p3_936
segnale	segnali	foil	0	( cinquecentomila ) È rozzo accontentarsi nella punizione distante del	f_p3_937
terzo	terzi	foil	0	( due ) Le stazioni per la votazione accogliente dovrebbero essere distribuite pensando prestito degli aggiornamenti e delle maternità del	f_p3_938
imprenditori	imprenditore	foil	0	( nove ) La flessibile stampante è assassinata a dipingere un elettromagnetico cambiamento di giornata passando l'	f_p3_939
professionali	professionale	foil	0	Lo collegio mondiale giudica egualmente un' ideologica nave dell' avvertimento iracheno ,	f_p3_940
nero	neri	foil	0	Il decoro del tribunale alpino dei treni dichiara a lasciarlo la divisione dell' angelo artistico , ciò che ritorna un	f_p3_941
abbondanti	abbondante	foil	0	( quarantotto ) L' incendio adottato nel Regolamento solenne sulla giustificazione estera geografica ai minerali , che grida un'	f_p3_942
storia	storie	foil	0	Appare sensibile complessità per dirvi che tali genitori siano esercitati nella	f_p3_943
foglia	foglie	foil	0	( duemila ) Sebbene sia intellettuale un esercito tessile alle	f_p3_944
protocolli	protocollo	foil	0	Vista l' urgente necessità di contribuire alla realizzazione degli impegni assunti nel quadro del	f_p3_945
interazione	interazioni	foil	0	( cinquanta ) Ai fascisti della siepe di indumenti pronti o di economiche schermate di agenzia riconquistate come	f_p3_946
corsia	corsie	foil	0	( quindici ) In rendita di quota delle obbligazioni di abitazione da comprensione dell' arma nel scalo della leale	f_p3_947
evidenti	evidente	foil	0	( cinquemila ) La gran colonna dovrebbe inevitabilmente consolidare l' accelerazione del grasso di barriera	f_p3_948
ingegnere	ingegneri	foil	0	Tale emarginazione potrebbe essere apparsa dall' automobilistica felicità di inserzioni sulla troupe dei loro generi e dalla normalità di	f_p3_949
bilancio	bilanci	foil	0	( cinque ) Nella differenziazione delle milizie di anarchia e del professor di	f_p3_950
rete	reti	foil	0	( dieci ) In pila di oppressione delle dipendenze di attenzione , la Cellulite dovrebbe almeno spendere nel degno legame la mancante	f_p3_951
rappresentante	rappresentanti	foil	0	( duemila ) Le ineleggibilità trasmesse alla moda dovrebbero consegnare aule sulle pulsazioni portate nell' ingresso della costituzionale minoranza al	f_p3_952
fette	fetta	foil	0	Dovrebbero essere accertati uno lettore di iniziative sull' imparzialità della dittatura assente del martello di strumentazione e sulle	f_p3_953
magistrati	magistrato	foil	0	L' assunzione e la precisione dell' avvertimento delle restrizioni definite dagli canoni di metafora audace dei	f_p3_954
piccola	piccole	foil	0	( 28 ) Per quanto concerne la formazione e l' informazione delle	f_p3_955
chiave	chiavi	foil	0	Tali telefonate dovrebbero estinguere lì il terremoto tra le loro detenute e le	f_p3_956
innocenti	innocente	foil	0	( diciotto ) Per le regole approvate nella disponibile scena , è agroalimentare rendere alle professionali denominazioni	f_p3_957
scienza	scienze	foil	0	La ricezione del Diritto del cinquecentomila agricoltore tredici sul memoriale della	f_p3_958
Stato	Stato	foil	0	( zero ) La stalinista destinazione è molecolare agli emergenti fogli noiosi , quali la documentazione cinquanta / mille / Faulkner del	f_p3_959
Camere	Camera	foil	0	Convenzione di mirra del fuoco che supera ed auspica la	f_p3_960
dimensione	dimensioni	foil	0	Conte , il comproprietario cattivo drammatico agli studenti , all' architettura e alla primavera per la sosta dell' indomani contro la	f_p3_961
anima	anime	foil	0	L' esempio trenta della fattura Diefenbach sorge che il reato di	f_p3_962
variabile	variabili	foil	0	- una sofferenza di scalinata aziendale rispetto al modo del cancelliere sulla	f_p3_963
garantite	garantita	foil	0	- una valutazione sull' inammissibilità di progredire e abbinare il sapore ,	f_p3_964
valore	valori	foil	0	Tale cifra risulta inferiore ai livelli antecedenti l' introduzione dell' euro , inferiore rispetto ai	f_p3_965
malattie	malattia	foil	0	Questa combustione rispettivamente settentrionale è il quaderno di una tarda	f_p3_966
aperta	aperte	foil	0	Dietro all' insediamento tredici della pietra Casarin , la locazione del balzo Stephen è stata	f_p3_967
valore	valori	foil	0	Il decennio ha inteso i reati sotterranei a mila delle eccezioni del	f_p3_968
legislazione	legislazioni	foil	0	- Per quanto rischia la commissione degli figli di intenzioni e i rocciatori / le	f_p3_969
chiusure	chiusura	foil	0	- Per quanto sfocia i grattacieli , il dicembre ha prestato probabilmente drammatici alcuni farmaci , assistendo	f_p3_970
viali	viale	foil	0	La quantità va affidata agli funzionari di diavolo e alla concorrenza tipografica , diventati	f_p3_971
Repubblica	Repubbliche	foil	0	- Va violentata la gita tra le esecuzioni / gli acquedotti energetiche / intensi (	f_p3_972
conversioni	conversione	foil	0	- In medicina all' elenco del maestro sulla successione della	f_p3_973
testi	testo	foil	0	- Per sopravvivere la serra dell' incastro del soffitto , tra l' altro ancor in chiarezza alla mezzanotte della crescita ad urbano	f_p3_974
cause	causa	foil	0	L' attuazione del programma è stata inizialmente lenta , a	f_p3_975
elenchi	elenco	foil	0	In maschera alle navi per il sedici , or l'	f_p3_976
presentino	presenti	foil	0	In mercato all' esercito è complementare che lo martello di questo calcio di irregolarità	f_p3_977
generi	genere	foil	0	Nel sapore dell' agevole fascino è stato ambientato velocemente uno passaporto lieto , che si avviene restituire a	f_p3_978
trasformata	trasformate	foil	0	L' oasi del tentativo Peschiera in spinta al piatto di carcere è	f_p3_979
giovane	giovani	foil	0	Nei primi capi i dilettanti erano per la superiore chiusura	f_p3_980
affari	affare	foil	0	A parlare dal tredici si affligge incessantemente una superiore salute delle equità nuove , mentre dal quattro - cento si sogna un	f_p3_981
compiuti	compiuto	foil	0	Nella relazione del forno si è mangiato di accedere radiazioni nella biancheria e la realtà di partecipazione ha	f_p3_982
sito	siti	foil	0	Dalla natura di filosofia interessa che i concorrenti gestivano da quattro filtri , sebbene si sappia una sosta di dilettanti degli Consigli	f_p3_983
intervallo	intervalli	foil	0	Alcuni drammi sono gravemente elettronici di altri nell' aderenza degli escursionisti , con l' USA che svela ad	f_p3_984
servizio	servizi	foil	0	In riferimento agli aspetti della protezione dell' euro di competenza degli Stati membri , sono stati sistematicamente consultati gli esperti dei rispettivi	f_p3_985
rappresentanza	rappresentanze	foil	0	È stata definitivamente rapita l' organizzazione mondiale e maschile letta all' acquirente mille della	f_p3_986
peso	pesi	foil	0	la sonorità è stata tenutasi sia a conto di cardinale normale dei dimostranti che in spedizione al	f_p3_987
grigi	grigio	foil	0	Si vieta in violenza di interpretazioni biologiche ad un curioso pontefice o occorrenti un greggio ecosistema ( mica innumerevoli particolarmente ai	f_p3_988
aziende	azienda	foil	0	Infatti al loro preavviso di conseguenza e previdenza , le	f_p3_989
lacrima	lacrime	foil	0	in molti presidenti sono stati divisi economisti culturali totali per la	f_p3_990
professioni	professione	foil	0	è stato entrato un capo di calamita sulle parole originali alla	f_p3_991
affermano	afferma	foil	0	Dove all' album quarantotto della cessione tunnel quarantotto / sette / Ronald del Trasferimento , del zero paragone nove , che	f_p3_992
dinamici	dinamico	foil	0	Il stabilimento di maglia menzionato è di sedici indigeni , mentre l' impianto di preavviso	f_p3_993
tetti	tetto	foil	0	Perfino egualmente alla sfilata del raffreddore del parroco Dominicana , è onesto esimersi tale	f_p3_994
stranieri	straniero	foil	0	- vederci villetta / indicazioni al gesso di letteraria approvazione ed aprire la resistenza originariamente ai	f_p3_995
tradizioni	tradizione	foil	0	- disporre tavola al nomignolo celebre particolarmente alle materie delle controversie in autobus della pura	f_p3_996
predatore	predatori	foil	0	Divieto della Distanza , del trecento superamento quindici , sovrastante il carbone di collo di governi prossimi nascenti dallo	f_p3_997
riscontri	riscontro	foil	0	In trattativa due obbligo nove la Bomba immediata ha preparato dal	f_p3_998
Consiglio	Consigli	foil	0	b ) In contraddizioni oblique speciali , gli quotidiani di istituti significativi e britannici nemmeno studieranno in antichi	f_p3_999
sostenuta	sostenute	foil	0	Photographic è in rottura alla bandiera , validamente da ogni problema , la maniacalità è	f_p3_1000
roccia	rocce	foil	0	Joe , Dumas , Pandolfo , ogni competitività con le sue '	f_p3_1001
rivestimenti	rivestimento	foil	0	Questa è una Madre ambientale , utilizzano i componenti periti dietro caserme di ingenuità contraffatte ,	f_p3_1002
coinvolta	coinvolte	foil	0	Ma affatto la manipolazione occupava tessuto mero e si è	f_p3_1003
sculture	scultura	foil	0	Eccolo il monumento dei martiri in Piazza della Bandiera , una grande	f_p3_1004
indicatore	indicatori	foil	0	Molto un settembre si è collocato dal biglietto prezioso al culto degli	f_p3_1005
costituzionali	costituzionale	foil	0	Nelle tv di Barcellona che hanno terrorizzato un diciannovesimo della restituzione c' vola lo nastro delle azioni	f_p3_1006
ponte	ponti	foil	0	E lo tessuto , che ricopre come gendarmeria un indiano rivale della diminuzione di Trasferimento , è stato cantato dal	f_p3_1007
combinato	combinati	foil	0	Usiamo ripartizione della sciagura della tv insolita nello spazio delle scorie eguali ha	f_p3_1008
ritardo	ritardi	foil	0	Laggiù c' aspettava la riabilitazione , che nascondeva lì il	f_p3_1009
ortodosse	ortodossa	foil	0	Ogni lago cercavamo materialmente un baldacchino per trarne sulla difficoltà	f_p3_1010
spessore	spessori	foil	0	E integralmente quell' ipocrisia , normalmente collegata un autore cattolico , ci stabilì che dall' accurata sera del	f_p3_1011
mortale	mortali	foil	0	Dopo la nave del raggiungimento noi eccetera rappresentavamo l' Aumento colmato ogni riparazione dalle attribuzioni	f_p3_1012
garanzia	garanzie	foil	0	E alcuni argomenti che lasciarono nondimeno ugualmente dopo la riscossione dello scetticismo iniziarono , a	f_p3_1013
europeo	europei	foil	0	Questo non vuol dire appoggiare un Governo piuttosto che un altro ma fornire , insieme ai partner	f_p3_1014
trovati	trovato	foil	0	La gestione - convalida - continuava assalti del tredici % al spunto sui rilevamenti	f_p3_1015
azzurro	azzurri	foil	0	I cataloghi delle vetture hanno legittimato il carburante di molte soglie e dopo aver ritrovato al favorevole quelle di universitari e	f_p3_1016
ritmi	ritmo	foil	0	Alla proporzione consideravano che stavano sapendo un architetto con rumorosità agricole , aprendo ai palchi	f_p3_1017
Consiglio	Consigli	foil	0	Le lire , per individuo , esistevano evitando archivi , livelli ed electronic economie di	f_p3_1018
tedeschi	tedesco	foil	0	Nella guardia seriamente verdiana d' UEFA e con un' isola apparentemente ispirata a intuire dalle soglie del	f_p3_1019
