opt1	opt2	type	corr_opt	sent	full_id
preziosi	prezioso	foil	0	Se rappresenti , puoi emanare questo apice asset al tuo etagere Duomo per essere	f_p3_1613
pittore	pittori	foil	0	Quando rappresenti una scientifica tuttofare , annota che sia mezza appieno zero periodi e di educare una poltroncina legittima di	f_p3_1614
scegli	scegliete	foil	0	Se la password da te immessa non è abbastanza sicura , prova a mescolare lettere minuscole e maiuscole o	f_p3_1615
errore	errori	foil	0	Puoi preservare la modificazione cristiana del tuo opinion con un	f_p3_1616
assumono	assume	foil	0	puoi appoggiare la coscia di sposare con vittime cardiovascolari , a cui	f_p3_1617
automatica	automatiche	foil	0	Character a una difficoltà di piante termiche di Capello arrivate a ricevitori di trecento autenticità ruandesi dappertutto delle frequenze	f_p3_1618
inviati	inviato	foil	0	I collanti avviati dalle castagne tossiche di Giove su Lesmo sono stati tra i maggiori cinicamente	f_p3_1619
maschio	maschi	foil	0	Occhio degli avvenimenti vulnerabili superiore al mille % rispetto all' inverno sconcertante nello vario	f_p3_1620
ciclo	cicli	foil	0	Le speranze hanno destinato un padrone sugli alunni legislativo , indirizzo ungherese per un' interferenza come Arkansas , realizzando che i	f_p3_1621
scene	scena	foil	0	Insieme puoi protestare gli investigatori di campioni , specialità , teorie comiche e molta effettiva	f_p3_1622
fenomeno	fenomeni	foil	0	"Per migliori importazioni sul patrimonio "" senti gli utilizzatori "" , ricorda il"	f_p3_1623
dimensioni	dimensione	foil	0	Molte delle armi di Spears sono state ritenute o hanno accettato dei watt , e sono turistica	f_p3_1624
regione	Regioni	foil	0	Suo padre , nato Bernard François , era uno degli undici figli di una famiglia della Tarn , una	f_p3_1625
obbligati	obbligato	foil	0	Aveva esattamente nominato il suo paragrafo con quello di una inferocita razziale maledizione , ed	f_p3_1626
ricevuta	ricevute	foil	0	La presentazione della sua violenza finì un patto eguale nella	f_p3_1627
traducono	traduce	foil	0	""" Specchi ( dal funerale Beatles Yuya di Olimpiadi , che si"	f_p3_1628
raggiunsero	raggiunse	foil	0	infine un abbraccio difficilmente era venuto Kempe - Hills ma	f_p3_1629
compreso	compresi	foil	0	( sebbene l' incompatibile deposito del vincolo prezioso Broadway - Damiano Galles Surin avesse	f_p3_1630
croato	croati	foil	0	Quando i grattacieli Chigi lasciarono a cucina , furono percepiti a serba scultura dai giornalisti , cosa che esplose benissimo il	f_p3_1631
comprendono	comprende	foil	0	Il suo volo del diciotto le Pierre dans la Turing	f_p3_1632
azzurri	azzurro	foil	0	All' addizionalità di sessanta alberghi Tyson fu tenuto alla delegazione immediata di ghiaietta a Torvajanica , tecnicamente continuò cinquemila	f_p3_1633
uso	usi	foil	0	Suo cancelliere , sapendo di ignorare la democratica toscana antenna del raduno che gli aveva lanciato l'	f_p3_1634
fossero	fosse	foil	0	Purtroppo , il simbolo preparato in ragazza gli disse tutto il marzo di vincere qualsiasi quaderno che gli	f_p3_1635
civile	civili	foil	0	""" Yankee si andava generalmente , al contadino da sfuggire il"	f_p3_1636
linee	linea	foil	0	""" Mladic valido interpretò la sua diplomazia a una "" tristezza uguale "" , ma la rilevata bolla nella """	f_p3_1637
serviva	servivano	foil	0	Izetbegovic - Zepa Kenya , imboccato di nobiliare dal Palace Dog ,	f_p3_1638
lesione	lesioni	foil	0	Quando i suoi distributori furono tagliati , Tokio fu staccato dal televisore a mantenersi la sua	f_p3_1639
costituzionale	costituzionali	foil	0	Nel muro le SIAE del sette , prese che un geometra nella classe	f_p3_1640
documentazioni	documentazione	foil	0	"Era lussuoso del suo essere "" un seno , una"	f_p3_1641
ragione	ragioni	foil	0	E questo è ciò che presentano sentirsi , questa ceramica sottratta alla	f_p3_1642
mano	mani	foil	0	Evidentemente , nell' arrivo del duecentomila gli fu riferito di spingere nella	f_p3_1643
altri	altro	foil	0	Comprendendo che avrebbe avuto difficoltà a trovare un compositore , tuttavia , si rivolse ad	f_p3_1644
beni	bene	foil	0	"Questo accesso protrasse ripetutamente , con molti dei bimbi "" portati come pelle da"	f_p3_1645
infiniti	infinito	foil	0	Diede in giuria l' inammissibilità ad un odore ( il quale la colpì al quinquennio ) ma morì	f_p3_1646
inchieste	inchiesta	foil	0	Dopo aver regalato diversi fogli , nel quaranta Policy costruì l'	f_p3_1647
tripli	triplo	foil	0	""" ugualmente se oramai lo arrivò Iron des Boy ( Maria di Hoxha ) , alla psicologia venne depositato"	f_p3_1648
religioni	religione	foil	0	Dopo il cacao della sua unanimità occidentale , Boeing esplose in Paolo e ricevette con la	f_p3_1649
cancellate	cancellata	foil	0	Ciò lo smise ad andarci come anticonformismo rilassato di protezione ( nonostante la pressione fosse	f_p3_1650
nudi	nudo	foil	0	""" la crisi e impossibilità del congresso , sono fuoripista eventuali della sensibilità di problema e del richiamo"	f_p3_1651
copie	copia	foil	0	""" la convocazione del forno finisce con l' estensione della"	f_p3_1652
funerali	funerale	foil	0	""" come suo convegno che aveva perduto la sua platea dalla volontà alla rumorosità giurisdizionale , GOTEBORG cercava il precario"	f_p3_1653
modo	modi	foil	0	"Per Balzac la storia rappresentava gli ingannevoli casi della vita , il suo """	f_p3_1654
sparò	spararono	foil	0	Il DE Mandela ( il pregiato custode Twitter , quattro ) fu il suo delfino capace , in cui Wilhelm	f_p3_1655
seno	seni	foil	0	Questi scientifici cibi agricoli - e le sue perquisizioni in Nations - gli aspettarono l' ossessione inevitabile in cui vedere i zero	f_p3_1656
canale	canali	foil	0	Il scacchiere comprende di Hendrix de North , un criminale	f_p3_1657
ispiratori	ispiratore	foil	0	la settima scheda ( delle ventun ) vede un lungomare di scontro di tredici	f_p3_1658
costituite	costituita	foil	0	Gli usi secchi sui miliziani ed università creano l' emissione	f_p3_1659
chiusure	chiusura	foil	0	neanche chiamava ripetutamente , ma cercava necessariamente con un' ungherese	f_p3_1660
bocca	bocche	foil	0	finì di aver riguardato una fotografia per trecento autonomie con una semantica	f_p3_1661
battello	battelli	foil	0	Se da un lutto alcuni dei suoi satelliti mica hanno veramente spiegato uno	f_p3_1662
vivono	vive	foil	0	""" in un sesto dramma era testualmente assurdo "" ,"	f_p3_1663
stanze	stanza	foil	0	Molti dei personaggi tormentati di Balzac furono creati nella piccola	f_p3_1664
facessero	facesse	foil	0	Rispose incontrando un' intimazione zairota nella caviglia di Crimea , mantenendo che la sua cifra autentica la	f_p3_1665
macchina	macchine	foil	0	Dopo una pallanuoto di file adeguate , dilemmi di lunghezza e vaschette da	f_p3_1666
affresco	affreschi	foil	0	Didoni recitò ventiquattro complimenti dopo il suo raduno , il trenta	f_p3_1667
cresciuto	cresciuti	foil	0	""" insomma "" , portò Caserta alla relazione , "" siamo preposti di shakespeariano perché è"	f_p3_1668
generi	genere	foil	0	La Fmi Commons trascorreva obbligatoria al bersaglio della sua modeste - John usava amministrazioni di apprendere numerosi agricoli	f_p3_1669
cavo	cavi	foil	0	""" l' ecosistema autentico che Marx guarda del complimento , tipicamente genero di insetti , per esporre la semplificazione dei suoi"	f_p3_1670
tedesche	tedesca	foil	0	"Nella maggioranza alla settima ondata de "" Spagna de la Zola"	f_p3_1671
cercavano	cercava	foil	0	""" i formaggi di Graham "" , equivale Droeshout , "" gli"	f_p3_1672
chiamavano	chiamava	foil	0	""" questo sportello fu superato dal linguaggio Angola Siro , che"	f_p3_1673
ministero	ministeri	foil	0	La cucina richiede dalle parità immobiliari , in giudice con i racconti del	f_p3_1674
regolate	regolata	foil	0	""" se a Bisbetica ci si dice ad essere in una materia"	f_p3_1675
castello	castelli	foil	0	La sua criminalità veneta concluse un compagno redditizio informato tecnicamente legalmente dal	f_p3_1676
cittadino	cittadini	foil	0	sotto molti eroi , egli è l' indebolimento del parcheggio	f_p3_1677
liquidi	liquido	foil	0	Persino , la sua indiana mattina delle madri della navigazione primaria gli scrisse cercare la bara di molti	f_p3_1678
confronto	confronti	foil	0	"Mentre dominava l' etnia di "" patriota "" , Strega ha successivamente capito da Scalfaro l' oppressione ai"	f_p3_1679
semplici	semplice	foil	0	""" allo legislativo chirurgo Benedetto Yanukovych ha incluso dall' abbigliamento"	f_p3_1680
ricami	ricamo	foil	0	Nel due Segurimi tornò con galla della villeggiatura di impennata da resistenza dei	f_p3_1681
fermo	fermi	foil	0	La galleria di Rucellai di una sovranità in cui geometria ,	f_p3_1682
teatrale	teatrali	foil	0	Le sue opere pervenute , che includono alcune collaborazioni , comprendono circa 38 opere	f_p3_1683
vendette	vendetta	foil	0	Le sue impressioni tradizionali sono state divenute in tutte le migliori	f_p3_1684
incendio	incendi	foil	0	Colpiscono pochi missili sulla cooperazione lenta di Benigni e c' è disciplinata una barese lana su assassini quali il suo	f_p3_1685
serbi	serbo	foil	0	Nel XVIII bue , il suo tavolo fu sottovuoto imposto e vinto da i	f_p3_1686
lastra	lastre	foil	0	Le sue infrastrutture tropicali comprendono assai tardi sufficienti e sono diversamente descritte , portate in	f_p3_1687
accettano	accetta	foil	0	"Nell' implacabile Reserve Germania , "" un barrage "" ,"	f_p3_1688
frangia	frange	foil	0	Nel cinquanta costruì MCC Scalfaro , la quinta sorveglianza viceversa gran di Belleville , e nel quindici attribuì in una	f_p3_1689
zuccheri	zucchero	foil	0	Nel quaranta , Valentina vinse la xenofobia secondo cui Velayati investì il radiotelemetro del	f_p3_1690
intitolato	intitolati	foil	0	il pretesto talvolta il suo modesto bacino , Georgia Madrid fu dimenticato commerciale di aver	f_p3_1691
annuali	annuale	foil	0	Hamer fu appropriato dal drammaturgo austriaco a pronunciarci giudiziaria nascita , squalificato che avrebbe convocato	f_p3_1692
volta	volte	foil	0	Gli Halls ebbero una figlia , Elizabeth , che si sposò due	f_p3_1693
minori	minore	foil	0	"Unico sollievo parallelo di riscossione , il turismo di spiegare "" il settimo mio ghetto"	f_p3_1694
soldo	soldi	foil	0	Alcune emissioni , come Foundation Errera e i primi pseudonimi rapidi , rimangono grasse , mentre i ventun rettangolari	f_p3_1695
bande	banda	foil	0	Come i mille testi di Libia , in cui tre individui decidono accettare un concentramento , la	f_p3_1696
splendida	splendide	foil	0	Le prime sostanze minuscole di Terra e quelle di elezioni editrice , che frequentano insolite religiose miglia e	f_p3_1697
sospette	sospetta	foil	0	Titolo di una missione di Natale Alessandra è una prossima rabbia tra barriere agricole , calamita	f_p3_1698
sovrano	sovrani	foil	0	"Secondo Montreal Verona bresciano di Guarneri , nel Massimiliano Peres "" i"	f_p3_1699
minoranza	minoranze	foil	0	A base dell' impegnativo Umberto , la cui puntuale calma fu l' autrice , per gli aghi delle	f_p3_1700
risultato	risultati	foil	0	"Secondo il radio Galeazzo Bisbetica , "" il ribilanciamento neppure evolve nè ai bersagli generosi nè al"	f_p3_1701
denaro	denari	foil	0	Le sue ultime bolle necessariamente inefficaci , Indonesia e Springsteen e Mister , presumono tra i	f_p3_1702
opera	opere	foil	0	Il frontespizio dell' edizione del 1594 del Tito Andronico rivela che l'	f_p3_1703
striscia	strisce	foil	0	I messaggi raramente si rimasero a formazioni a rispettare la quarta	f_p3_1704
monetaria	monetarie	foil	0	Nonostante le tendenze sulle invenzioni siano efficaci , i Joe 's Fossey aspettarono a	f_p3_1705
pubblicarono	pubblicò	foil	0	La sfilata opposta , assegnata al gatto per le piccole nazioni capitaliste ,	f_p3_1706
rossonero	rossoneri	foil	0	Davanti , il nove stile un preavviso smise il pollice del Tiro , andando rigorosamente , un	f_p3_1707
considerava	consideravano	foil	0	Nel tremila Robert Statua e Lehan Lord , cinquemila degli interrogativi di Yankee che	f_p3_1708
condizione	condizioni	foil	0	Molte delle azioni erano qualvolta state presentate nelle loro voci in diciottesimo - rapporti governativi di pagamenti di	f_p3_1709
imbarcato	imbarcati	foil	0	"Alema Berti permise alcuni di questi "" narcos demo "" verificato che erano cereali"	f_p3_1710
emendamenti	emendamento	foil	0	Le tasche possono negoziare da intenti di cifra o di disoccupazione , dagli enfiteuti degli	f_p3_1711
deliberazioni	deliberazione	foil	0	Negli avvenimenti quaranta e ventun , quando i pastori fornirono chiusi a	f_p3_1712
critico	critici	foil	0	Ad esempio gli imponenti discorsi in Tito Andronico , secondo alcuni	f_p3_1713
ritenuto	ritenuti	foil	0	e i soccorritori ne I cinquecentomila farmaci di Sofia sono stati	f_p3_1714
semplici	semplice	foil	0	Mica indica un' ischemia in costruttore che ecceda la classifica dallo supermercato	f_p3_1715
fantasmi	fantasma	foil	0	Bond li preoccupa per tutta la sua prestazione , Franceschi e Theatre è spudoratamente l' accesso miglior di questa calma di	f_p3_1716
imposizioni	imposizione	foil	0	Questa comprensione giura semantica commozione e possibilità ai magistrati di	f_p3_1717
sacri	sacro	foil	0	"Il corpo nerazzurro Iapichino Nidal ha garantito il suo fuoco come "" ripetutamente"	f_p3_1718
circostanze	circostanza	foil	0	Come tutti i ceti del svolgimento , accadeva per il contributo	f_p3_1719
potenza	potenze	foil	0	Questa cura di sostituzione rivolge che un' esperienza di Pino possa tagliare alla	f_p3_1720
viti	vite	foil	0	Con il protestare della sua riunificazione , Nettuno ha venduto ai suoi verbali	f_p3_1721
istituzioni	istituzione	foil	0	In ogni bracconaggio , ha tradotto amministratori del suo gruppo agroalimentare nelle ultime	f_p3_1722
debole	deboli	foil	0	"Il critico George Steiner ha descritto tutti i drammi in versi da Coleridge a Tennyson come """	f_p3_1723
pezzo	pezzi	foil	0	L' interprete furbo valido North Francia , edema di Sydney Selva , ha seriamente pronunciato Hortensia in	f_p3_1724
apparato	apparati	foil	0	Francis mica è stato ammazzato quando era in convergenza , ma ha considerato molti	f_p3_1725
ereditaria	ereditarie	foil	0	Magari , il consumo e ministero Wilhelm Nicholson lavora un'	f_p3_1726
greche	greca	foil	0	"Il sopralluogo e rigore Robb Coetze France si continuò fantasia del magazzino dell' autorizzazione di Magic , realizzando """	f_p3_1727
diretti	diretto	foil	0	La polvere giurisdizionale nell' iscrizione durante il xx concentramento , tecnicamente	f_p3_1728
incertezze	incertezza	foil	0	Gli appelli in Certosa e i quadri a CRS stabilirono delle basi delle sue	f_p3_1729
ebreo	ebrei	foil	0	Il giugno e terrorista vivace Mostro Vasari ebbe un difetto	f_p3_1730
lettori	lettore	foil	0	Negli ordigni trecento , gli battenti di Fed si ebbero a soliti pagamenti come lo litorale , il	f_p3_1731
rischio	rischi	foil	0	Alcuni dipinti promettono che i sequestri della concorrenza di Vincenzo fossero	f_p3_1732
sono	è	foil	0	Nessun documento contemporaneo descrive l' aspetto fisico di Shakespeare e non ci	f_p3_1733
vicino	vicini	foil	0	Questo capitano smise intenzionalmente alla bara di medi fallimenti , importazioni acide , ghiandole e particelle di	f_p3_1734
geometrici	geometrico	foil	0	E recitare indiscriminatamente queste sedici chitarre può scommettere un pranzo comodamente	f_p3_1735
esisteva	esistevano	foil	0	E quelle limitazioni firmarono l' allenatore e l' aspettarono sotto la riparazione e nel trono perché	f_p3_1736
traducono	traduce	foil	0	Il lutto tra la diaspora dell' attentato e quella degli abusi alternativi , in pensione si	f_p3_1737
faccio	facciamo	foil	0	Versiamo la frequenza della leggerezza egemone , il food , gli aghi delicati , e	f_p3_1738
distinzioni	distinzione	foil	0	Perché quando noi aspettiamo la sala di quella bestia con tasche che neppure dovrebbe rafforzare , ne chiediamo delle	f_p3_1739
misura	misure	foil	0	Nemmeno importa impegnativo gusto in questo negozio se nemmeno che le bolle formino in un avvertimento lì separatamente liberale di	f_p3_1740
compreso	compresi	foil	0	Ma quelle statue stanno sapendo i Martin attraverso il disco del proprio scavo	f_p3_1741
perdita	perdite	foil	0	E quella pietà violentemente perpetua sentiva negli ostaggi arabi che riuscivano quella	f_p3_1742
politiche	politica	foil	0	L' Argentina e il Venezuela hanno esaurito le possibilità della	f_p3_1743
brevi	breve	foil	0	In Olivetti piange la settimana per la bomba di difetti consumabili e infanzia , mentre l' aeromobile	f_p3_1744
evento	eventi	foil	0	Questa neppure è la terza patria che i meccanismi in falla di stabilimento sono fabbriche dei significativi risultati d'	f_p3_1745
fragili	fragile	foil	0	Gli elenchi , in spostamento , avrebbero dovuto insistere alcune fattorie	f_p3_1746
dinamico	dinamici	foil	0	I razzi esclusivi si proseguono di sbarco , e per dei	f_p3_1747
formale	formali	foil	0	fuochi autonomi delle tensioni prime , vani di origano misteriosi e	f_p3_1748
esercizio	esercizi	foil	0	Il disastro in benefici di tragedia perpetua e spie generazionale ha spiegato attualmente esso il proprio codice , ma si pensa di	f_p3_1749
esauriti	esaurito	foil	0	In quinto contrasto , la borgata magica è stata eseguita in carattere	f_p3_1750
sostituiti	sostituito	foil	0	Senza il Silvio , che originariamente la Federico sta puntualmente passando , il paio svedese sarebbe stato indubbiamente frequentemente	f_p3_1751
drammatica	drammatiche	foil	0	Allo sguarnito rilevamento , quando gli indagati studieranno a generare le bibite religiose reciproche e a rivelarsi le	f_p3_1752
chimici	chimico	foil	0	recarsi rurali cavalli giurisdizionali sui membri di matematica , o essere	f_p3_1753
industria	industrie	foil	0	Ovviamente , pesantemente , è scaduto il designatore di disporre a come il ministro possa comprare un povero angolo tra mafia ed	f_p3_1754
obbligo	obblighi	foil	0	Nel senso , l' Euratom Enver e la Stefani stanno conservando composizioni per sottoporre i loro	f_p3_1755
campionato	campionati	foil	0	"Come ha coniato il figlio obbligatorio per il braccio , Anders Banja , "" è povero consentirci ai"	f_p3_1756
compagnia	compagnie	foil	0	Secondo un prestito fondamentale diventato dagli ostaggi Samuele David e Ali Filippine , se l' Iapichino rilevasse i banchi di	f_p3_1757
differenza	differenze	foil	0	Spesso nell' assemblea storta , gli automobilisti nulli legittimi potrebbero inserire a mille motivi di cataloghi , mentre il debitore della	f_p3_1758
sciatori	sciatore	foil	0	Negli ultimi cinquecentomila albi , l' EUR ha affermato o accettato i	f_p3_1759
generazione	generazioni	foil	0	Secondo i creditori , tranquillamente , girare ai talenti giurisdizionali di cuocere i delitti chiamati consentirebbe una	f_p3_1760
spada	spade	foil	0	Il medagliere testualmente pesante , come ha dimostrato l' iguana di	f_p3_1761
profitto	profitti	foil	0	La pietà favorisce che la prigione della parità equivalente è un sorriso elettronico a cui i	f_p3_1762
sorgenti	sorgente	foil	0	la piccola e cristiana nobiltà medica in tutto il pensiero ( ossia , una	f_p3_1763
lavorano	lavora	foil	0	A comunicazione i verticali pappagalli di conte , secondo alcuni l' acqua romana	f_p3_1764
diffuso	diffusi	foil	0	È completamente l' insediamento su cui è stato cacciato il metodo di Piramide e la malafede che hanno	f_p3_1765
composti	composto	foil	0	"Basta ( in un nomignolo dal contenuto contenuto "" il proposito del termine"	f_p3_1766
ricadono	ricade	foil	0	"In "" la conquista della competizione demografica "" , Fendi Jean e Fabiana Kola della Mariateresa Toronto Garda"	f_p3_1767
leggendarie	leggendaria	foil	0	I cinquemila piloti vulnerabili che hanno confermato questo imprenditore sono stati l' oliva del genocidio e il comunitario apprendistato delle statuette	f_p3_1768
peggiori	peggiore	foil	0	Avrebbero potuto eliminare più intensità di meccanismo per le cerimonie e	f_p3_1769
attentato	attentati	foil	0	Bastano che la patetica gente del pontefice problematico detiene l'	f_p3_1770
vero	veri	foil	0	Oppure potrebbero usare il loro talento per progettare , diciamo ,	f_p3_1771
favorisce	favoriscono	foil	0	I sospetti di sanguinosa balia nell' unità sommersa sono specialmente enunciati ai tabù idrogeologici , in statura perché i tagli ormonali persino	f_p3_1772
filare	filari	foil	0	Chiunque si preferisce degli cartelli agricoli e dell' appassionato spettro al dilettante	f_p3_1773
risultanti	risultante	foil	0	Il senatore dell' elaborazione nella temperatura cosmetica di Popolazione Fiorini abita una vigilanza	f_p3_1774
segmenti	segmento	foil	0	Quando i manifestanti hanno rinunciato un aeroporto fragile alle ricostruzioni oblique di Rita il mille	f_p3_1775
critica	critiche	foil	0	Gli edilizi hanno frantumato la loro doccia all' Ante Aleksander che è essa sofisticata poi	f_p3_1776
portieri	portiere	foil	0	È per questo scioglimento che l' Arco è stata indipendentemente liberamente scarsa della Minnesota nei	f_p3_1777
intervenuto	intervenuti	foil	0	Come rappresentato , l' Orsi sotto la troupe residua ha	f_p3_1778
richiamo	richiami	foil	0	Intanto , direttamente che l' emergenza della lingua opaca per un	f_p3_1779
clinica	cliniche	foil	0	La figlia nemmeno ha ripetuto alle tessili ghirlande , ma si è avviata a segnale di chi veniva conferito dalla	f_p3_1780
interno	interni	foil	0	Ma realizzare questo potenziale richiede un miglioramento del clima imprenditoriale in tutta l' economia nel suo complesso e all'	f_p3_1781
campagne	campagna	foil	0	Un compimento automatico di immettervi tale rientro a un curioso baseball di sussidiarietà bisognerebbe di proclamare con moschee contrarie divenute dalle	f_p3_1782
oscura	oscure	foil	0	L' Alamo potrebbe liberamente accecare il proprio godimento pallido alle speranze stabilite o erette dalle frequenze perlopiù o sensibilmente chimiche delle diocesi	f_p3_1783
amica	amiche	foil	0	Trito e vengo che l' Edwin sotto la solidarietà buona sia all'	f_p3_1784
temi	tema	foil	0	Tuttavia , nemmeno copre alcun biglietto di giornalismo delle regole di	f_p3_1785
solare	solari	foil	0	In sega , la lentezza dei segni di teoria è il pericolo debole dell' abolito genio dell' approvazione	f_p3_1786
magica	magiche	foil	0	A perpetuo estinguersi , la colonna tocca a una compagnia d' unità , professionali anni e , virtualmente , a una calamita	f_p3_1787
vigili	vigile	foil	0	Tra i sedici food sono volati prezzi su un' automobilistica fusione di cartelle , tra cui il commediografo , il	f_p3_1788
assicurato	assicurati	foil	0	Il particolato della Torinese dipenderà al lascito di onorare il meeting di prestigio , che sarà	f_p3_1789
santuari	santuario	foil	0	Dalla sussidiarietà suprema eccessiva della ricerca degli acquedotti mila è apparsa come l' impugnazione successivamente terribile della corteccia , e desidero il	f_p3_1790
precedente	precedenti	foil	0	Cambridge - la promessa che ogni generazione se la caverà meglio della	f_p3_1791
conosciuto	conosciuti	foil	0	Attualmente nel trucco in facciata di storicismo la mentale lastra delle particelle ha inaugurato a vederci i	f_p3_1792
sedi	sede	foil	0	Tuttavia , ogni coesione nell' assemblea solida sul censimento della	f_p3_1793
raggio	raggi	foil	0	E , malgrado uno fragile commento della mula di quinquennio della consapevolezza negli ultimi	f_p3_1794
api	ape	foil	0	Concludendo da natura i rettangolari parametri narrativi , favoriscono forti curve da dormire , radicalmente trasmittenti da	f_p3_1795
vantaggi	vantaggio	foil	0	Nemmeno si può rapidamente favorire per balcanica questa posizione , dal possessore che l' afa di cessazione e precedenza ha aiutato il	f_p3_1796
fissato	fissati	foil	0	Il quinto terremoto è l' albergo tipico , una frequenza che riguarda nazioni balcaniche appieno ai scrittori chimici disotto	f_p3_1797
vetture	vettura	foil	0	Un uccello rampante è l' occupazione abbondante - un' irritazione fatalmente la	f_p3_1798
impatto	impatti	foil	0	Ciò che si coordina dappertutto è che l' incolumità incompatibile è modificata esterna in molti rimasugli , con un invisibile	f_p3_1799
rivelato	rivelati	foil	0	E intenzionalmente , malgrado un negoziale pristino di merce di magistrati , i progressi rispettivi sono	f_p3_1800
privato	privati	foil	0	Le economie capitaliste sono state straordinariamente efficienti nel consentire il crescente consumo di beni	f_p3_1801
compito	compiti	foil	0	In potere intatto , la periferia Lombardia - Ligresti che ha spiazzato questo gregge fu lanciata dall' artiglieria - i	f_p3_1802
corrispondenti	corrispondente	foil	0	Ma mica è follia nominale sopprimere perfettamente il secolo di sviluppo soprannominato dallo jammer oblique o il litorale in contanti di colombi	f_p3_1803
maggiori	maggiore	foil	0	"Nella nostra aspettativa del "" reattore muove tutto "" , una barbarie annua che sfocia un"	f_p3_1804
sedi	sede	foil	0	Insomma , se un' origine , come gli profili Umbria nel scopo primitivo , rapita a una migliore	f_p3_1805
milione	milioni	foil	0	pienamente possiamo favorire in mantenimento elisabettiano il sondaggio che , printer ai giochi riciclati in	f_p3_1806
senatori	senatore	foil	0	Nemmeno si può nemmeno portare che , alla zingara , il fideiussore delle preminenti origini biologiche alla carreggiata a cinematografico	f_p3_1807
manovre	manovra	foil	0	"Il traffico di quest' interrogativo è stato "" la nascita e la"	f_p3_1808
diplomi	diploma	foil	0	neppure tutti ammalano la propaganda con le giuridiche crisi di	f_p3_1809
giudiziaria	giudiziarie	foil	0	Innanzitutto , ovviamente nelle validità autonome , un' appropriata chiave	f_p3_1810
greggi	gregge	foil	0	Infine , la dinamite infinita può applicare il procedimento di fotografie fondiarie come l' ineleggibilità , il	f_p3_1811
talenti	talento	foil	0	I discendenti alla buccia hanno raggiunto che frammenti efficienti per valere squadre balcaniche -	f_p3_1812
stranieri	straniero	foil	0	L' estradizione dei nuclei e della droga della finezza collettiva su un	f_p3_1813
dipendenti	dipendente	foil	0	Dato quanti stanchi pressi hanno minacciato la cameriera in cui le inserzioni di una natura facciano le terapie delle sue	f_p3_1814
